id|emoteid|event|type|text
2105|1154|3|1|folds under its own weight as its life blood abandons it.
2106|1155|1|1|raises its body up and rushes forward at silently with venom dripping from its fangs.
2107|1155|3|3|As it collapses, almost delicate in death, you feel the ancient presence of this primal creature disperse into the caverns.
2108|1156|1|1|mutters a prayer to the god of the sea for the power to defeat the enemy.
2109|1156|3|0|I come to you now, Trushar.
2110|1157|1|3|The Primal Beetle emits a deafening shriek as it scuttles toward you, causing the ground to shake and rocks to tumble from the roof of the cave.
2111|1157|3|1|falls to the ground with a deafening crash. Everyone in the area senses the powerful primal essence of the beast lingering for a moment before dispersing among the caves.
2112|1158|1|1|bursts into sudden and swift action, moving faster than should be possible for such a beast of such bulk.
2113|1158|3|1|causes the ground to shake as it dies, but you can feel the essence of the ancient beast linger a moment, then disperse into the caverns.
2114|1159|1|0|Ah, the bittersweet feeling of extreme pain. Revel in it, you infidels. You are no better than them. Come witness teh power Trushar has blessed me with.
2115|1160|1|0|Fall prey to my beauty, weakling!
2116|1160|3|1|wraps its tail around its body before falling to the ground.
2117|1161|1|0|I do not need eyes to find your beating heart with my arrow.
2118|1161|3|1|falls to the ground silently and emotionless.
2119|1162|0|1|bellows a battle cry for all to attack the legion's enemies.
2120|1162|3|3|Dark blood spews from its mouth as the battle hardened mastruq takes a final swipe.
2121|1163|1|1|sizes up its victims head for its next trophy.
2122|1163|3|1|enjoys the gift of a painful end.
2123|1164|1|1|grunts and snorts as it prepares to smash and crush enemies.
2124|1164|3|1|utters an apology to Mata Muram.
2125|1165|1|0|You will soon know why all fear the bows of the kyv.
2126|1165|3|0|This is the death to be proud of.
2127|1166|1|0|You are a waste of this thick air!
2128|1166|3|1|collapses to the floor in a pool of black blood.
2129|1167|1|0|You do not embrace pain as we do. Endure the suffering we bring!
2130|1167|3|0|Death is but a stepping stone to greatness.
2131|1168|1|0|You dare challenge the might of a M'sha?
2132|1168|3|1|stomps its hooves against the ground as it stumbles lifelessly.
2133|1169|1|0|You dare challenge the might of a M'sha?
2134|1169|3|1|crackles with cords of dark energy as it falls to the ground.
2135|1170|1|1|swiftly moves to attack.
2136|1170|3|1|falls to the ground, fresh blood spilling from its wounds.
2137|1171|1|1|snickers at you and prepares to kill!
2138|1171|3|1|loses her presence in this realm.
2139|1172|1|1|hones in on your essence before attacking!
2140|1172|3|1|is doomed to eternal death, quickly and silently.
2141|1173|1|1|screeches eerily before heading in your direction.
2142|1173|3|1|defiantly falls to the ground, once again lifeless.
2143|1174|1|1|screeches eerily before heading in your direction.
2144|1174|3|1|quietly returns to the spirit world.
2145|1175|1|1|seeks to invade a weak mind!
2146|1175|3|1|can no longer attack the living with his wily ways.
2147|1176|1|1|springs at you, ready to attack!
2148|1176|3|1|exhausts her hold in this realm.
2149|1177|1|1|bolts towards you with lightning speed!
2150|1177|3|1|relinquishes control of her spirit in this world.
2151|1178|1|1|motions towards you before attacking!
2152|1178|3|1|loses his presence in this world
2153|1179|1|1|prays for a destructive force to assist him!
2154|1179|3|1|lifelessly falls to the ground, hopefully for good.
2155|1180|1|1|gets its bearings and continues its assault on the relic thieves!
2156|1181|1|1|recognizes those who took its relics and prepares for battle.
2157|1182|3|0|You...can not...defeat us all...
2158|1183|1|0|Halt in the name of Antonius Bayle! Fleeing will only make me angry and your beating more severe!
2159|1183|9|0|How I loath to soil my blade with such filth.
2161|1184|1|0|I shall chop you down as your people chopped down the beauty of the forests!!
2162|1184|3|0|Long live the green ..
2163|1182|4|0|Of course I'm a Bloodsaber, you fool! I've just returned from the Plains of Karana where I was reveling in the glory of the Plaguebringer. Now then, since I see that this foolish investigator is with you, I suppose you want me to sign a confession document or something like that? Well, let's have it then!
2164|1185|1|0|Hail! In the.. 'burp'.. name of.. 'hic!'.. oh my tummy.. Antonius Bayle!
2165|1186|4|0|Welcome to my humble establishment!  I specialize in cloth, but lately I have begun to dabble in silk, the finest material I have ever used.
2166|1187|1|0|You shouldn't interfere in things that you know nothing about.
2167|1187|9|0|That will teach you to interfere with our plans.
2168|1188|4|0|Hello. I am afraid I cannot tell you much about my merchandise. I was hired by Ton to look after the shop at night. I can tell you that you would find a better deal during the daytime hours. Ton instructs me to charge more for nighttime service.
2169|1189|3|1|dies.. Rodcet Nife is not pleased.
2170|1190|4|0|Greetings and welcome to Ironforge Weapons! Be sure to purchase Ironforge weapons. they are assured not to break during combat.
2171|1191|4|0|Greetings, and welcome to my shop. I am humble merchant Shenro Kazpur of the Silent Fist Clan.
2172|1192|4|0|Greetings! I am Jaylin Monel, your Highkeep bank clerk. If you are here to close an account, please return your strongbox key to my assistant Kiolna and she will return any items you may have stored.
2173|1193|4|0|Bug off!! Unless yo want an Irontoe boot to caress your head?!!
2174|1194|4|0|Hello. I am Tarn Visilin.
2175|1195|1|0|The single death of a member of the Paladins of Tunare shall plague your wretched life.
2176|1195|9|0|Let no evil beings stand in the way of the righteousness of the Paladins of Tunare!
2177|1196|3|0|What madness is this? How could I have been defeated? I beg of you Xegony, please forgive my weakness.
2178|1197|3|0|Your efforts are commendable, but you will not get far. By Coirnav, you are doomed to failure.
2179|1198|1|1|roars, 'Mortals, here? I will torch you alive for this atrocity!'
2180|1198|3|0|You can extinguish the flame of my existence, but you are nothing compared to the might of Fennin Ro!
2181|1199|2|1|coughs, 'Not bad, for mere amateurs. A commendable exertion on your part.'
2182|1200|3|1|topples, his shelled cranium splitting with a sickening crunch as it strikes the ground.
2183|1201|3|1|loses its semi-rigid consistency and deflates. The burbling noise and fetid scent are nauseating.
2184|1202|1|1|snarls with determined fury, then rushes directly at you!
2185|1202|2|1|stumbles and lies prone, taking breaths in punctuated gasping snorts. Its eyes slowly close as it ceases breathing.
2186|1203|1|0|If you were looking to play war, mortals, you will get all that and more. Prepare to soak my battlefield in your blood!
2187|1203|3|1|coughs, 'Not bad, for mere amateurs. A commendable exertion on your part.'
2188|1204|3|1|produces a bloodcurdling scream as she is cut down.  Prone and dying, she sighs her final words, 'This cannot be...It is not yet my time to pass.  An unlife as glorious as mine deserves continuance.'
2189|1205|3|1|stares at his hands, a look of disbelief and horror on his countenance. 'Innoruuk, I have failed you!'
2190|1206|1|0|Can you even fathom the infinite torture and suffering in store for you?  I thought not.
2191|1206|3|3|A voice echoes from the skeleton's shattered skull, 'This is not the first time I have been 'killed', and it will certainly not be the last.  Be always on your guard, mortals.'
2192|1207|1|0|What twisted reasoning would possess you to travel here and challenge the gods themselves?  Your madness knows no bounds!  The only sensible course of action is to end your miserable existence.
2193|1207|3|0|This is not over, fools. My death here is merely the beginning. I will return to you in your most horrible nightmares!
2194|1208|3|1|whines pitifully as it stumbles and topples over.
2195|1208|1|3|A throaty, rumbling growl emanates from the wolf-beast.
2196|1209|3|1|can support itself no longer and crashes to the ground in a writhing mass of flesh.
2197|1210|3|3|There is a brief reprieve as the elemental behemoth ceases its onslaught.  It teeters, then comes crashing down.  The force of impact is tremendous, shaking what you imagine to be the entire plane.
2198|1211|3|0|Squeeeeeeee!  Squeeee. . .
2199|1212|3|0|This is no victory for you, only a delay of your inevitable demise
2200|1213|1|0|Now is the chance to prove my power reigns supreme. Prepare to feel the power of nightmares shatter your soul!
2201|1213|3|0|My armies have failed. . . how could this have happened?
2202|1214|1|0|No!  That's impossible!  Be gone from this place, mortals!
2203|1214|3|0|My minions. . . my power. . . lost.  Impossible. . .
2204|1215|1|0|I hope you have lived your life with no regrets, for now it shall come to an end!
2205|1215|3|0|Foolish mortals, you know not what you do. Continue on this path and you shall lead us all to destruction!
2206|1216|1|0|Welcome to your final stand, mortals. You shall progress no farther!
2207|1216|3|0|You stand to gain no honor in my death. May the wrath of Rallos Zek strike you down with great vengeance.
2208|1217|1|0|Defeating my sons in battle is impressive, but your legacy ends now.  If no one else can stop these mortals, then the power of War shall!
2209|1217|3|0|My mantle shall never be passed on...
2210|1218|7|1|paws at the soil in anticipation, then charges full-bore directly at you!
2211|1219|1|0|Your kind have invaded my home for long enough.  If you thought you knew what hate was before, I have one last lesson to teach you!
2212|1219|3|0|This cannot be. . . I will return. . . somehow, in some way. . .
2213|1220|1|0|For the defeat of my daughter, I shall make sure you know fear as none have ever experienced it before!
2214|1220|3|0|Noooo. . . fear. . . shall never die. . .
2215|1221|1|0|Imagine every debilitating disease in the world stripping away your body and mind.  Now prepare to experience that feeling by a hundred fold!
2216|1221|3|0|Defeat by mortals. . . impossible.  The power of decay still beckons for you. . . someday. . .
2217|1222|3|0|Death will claim you, make no mistake about that. Bertoxxulous will not be so easily thwarted!
2218|1223|3|0|So be it. I return to the dust from whence I came.
2219|1224|3|1|is aghast with horror, 'No! I cannot be defeated!'
2220|1225|3|1|collapses, foamy drool dribbling from the beast's quivering maw.
2221|1226|3|1|returns to the elements from which it was formed.
2222|1227|3|0|Nooooo, I was not finished with you yet!
2223|1228|3|0|Squeeeeeeee!  Squeeee. . .
2224|1229|3|1|oozes foul smelling viscous blood.
2225|1230|3|1|attempts to swing one final time as its limbs disconnect and tumble to the earth.
2226|1231|3|1|spills to the floor in a pile of misshapen rock.
2227|1232|3|0|Avenge me, brothers! No mercy, no quarter!
2228|1233|3|1|coughs, 'Not bad, for mere amateurs. A commendable exertion on your part.'
2229|1234|3|0|The bringer of disease will have your filthy heart.
2230|1235|3|1|splatters, spreading out in a thick noxious ooze.
2231|1236|3|1|mutters a curse in an unknown language as he falls.
2232|1237|3|1|cries out, 'Innoruuk, I beseech you! Forgive me this failure!'
2233|1238|3|1|winces in pain as he falls.
2234|1239|3|1|lists, then topples over with a sickening cry.
2235|1240|3|1|exhales a foul deathcry, 'Mmgraaaugh. . .'
2236|1218|3|0|Squeeeeeeee!  Squeeee. . .
2237|1241|3|1|cries out, with a bloodcurdling screech, 'Aaaaugh! I am slain, master Kazrok!'
2238|1242|3|1|topples over, the stones grinding out a sound, 'Teeeeerlok.'
2239|1243|3|1|grinds its joints in a deafening roar, 'Raaaaaaaathe.'
2240|1243|1|1|shakes in anger at your defiance.
2241|1244|3|1|squawks as it crashes down in a hail of feathers, 'Neimon!'
2242|1245|3|1|shatters. Splinters of bone and foul dust taint the air.
2243|1241|1|0|You seek to destroy me, a mere minion? What cowardice! My master shall burn the flesh from your body!
2244|1242|1|1|vibrates and shudders as it attacks.
2245|1231|1|1|advances quickly, giving you no reprieve.
2246|1246|1|1|gurgles an incomprehensible warcry as it sets upon you.
2247|1229|1|0|In time, you will be extremely regretful for your trespasses here. That time is now.
2248|1244|1|1|swoops down, talons outstretched and ready to strike.
2249|1196|9|0|Yes, sleep. To fight is futile. Lay still, and do not rise to challenge us again.
2250|1245|1|1|stirs suddenly, and stretches out a bony hand to grasp you.
2251|1223|1|1|opens its mouth in a silent scream.
2252|1227|1|1|shrieks with demented laughter as it sets upon you.
2253|1247|1|1|paws at the soil in anticipation, then charges full-bore directly at you!
2254|1226|1|1|Mortals? Here? You will be destroyed for your curiosity and carelessness!
2255|1248|1|1|lumbers toward you with a singular purpose.
2256|1249|1|1|vibrates and shudders as it attacks.
2257|1250|3|1|spills to the floor in a pile of misshapen rock.
2258|1250|1|1|vibrates and shudders as it attacks.
2259|1248|3|1|attempts to swing one final time as its limbs disconnect and tumble to the earth.
2261|1232|1|1|charges with a thunderous battle roar.
2262|1228|1|1|snarls with determined fury, then rushes directly at you!
2263|1211|1|1|paws at the soil in anticipation, then charges full-bore directly at you!
2264|1251|3|3|With a pitiful whine, the Ferocious Warboar stumbles and lies prone, taking breaths in punctuated gasping snorts. Its eyes slowly close as it ceases breathing.
2265|1252|4|0|Hullo!!  Me is Boomba.  Me make da bestest pickles in da Norrath. Me gots da dwarfies. da halflings. da humies - me even gots da pixie pickles!!  Of course all of dem were baddies from da dunjuns.  Da guards say it gud ta pickle da baddies.
2266|1253|4|0|It is good to see new customers here in Brownloe Bakery. but I am very busy right now. If you would like to purchase something. please speak with my wife. Pincia.
2267|1254|3|0|The good people of this city will know of this. They will strike back at you!
2268|1255|3|0|You have no idea what a big mistake you made. Either my fellow rogues shall find you or the Freeport Mi.. Unnnghh.
2269|1256|3|0|Squeeeeeeee! Squeeee. . .
2270|1257|1|0|I abhor violence, but if you insist I will send you to Karana.
2272|1257|9|0|I'm sorry that it was necessary to kill you, but you left me little choice.
2273|1013|8|1|burrows through a small hole in the wall, then vanishes.
2274|1013|1|0|I have no time for trifles, I will kill you quickly so I may be on my way.
2275|1013|3|0|My parcel! Blast you! Regardless your interference will not delay the inevitable.
2276|1258|4|0|How are you. bub?  Enjoy the drinks. but watch your gold.  There are rogues everywhere.
2279|1259|3|0|You shall have all the Crushbone orc legions on your tail for my death!
2280|1260|1|0|Let no evil beings stand in the way of the righteousness of the Paladins of Tunare!
2281|1261|3|0|Fool! The dark elves will slay you for interfering with my duties!
2282|1262|1|0|The power of Underfoot shall smite thee!
2283|1262|3|0|I pray for your vile soul. Soon it shall meet its fate by the power of the Clerics of Underfoot.
2284|1263|1|0|I will suck your soul into the endless torture that is my existence!
2285|1264|1|0|Your worst nightmares shall not compare to the torments I will now bring upon you for your transgressions. All hail Cazic-Thule!
2286|1265|1|0|That was not a very intelligent thing to do.
2287|1265|3|0|My comrades will avenge my death.
2288|1266|1|0|Die like a fool you are!
2289|1267|1|0|I shall sing of your demise!
2290|1268|1|0|Rodcet, protect your loyal servant!
2291|1268|3|0|My comrades will avenge my death.
2292|1269|2|0|You can't break the Circle.. kill one, and.. there will always be another to take his place.. and.. take revenge.
2293|1270|1|0|Mighty Karana, help me show the inferiors the true power of rain and storm!
2294|1271|1|0|You dare incite my wrath? Impudent worm, I shall raise your corpse as my follower and teach you what you should already know - that I am your better.
2295|1272|1|0|Do not yet celebrate your victory, mortals. I, Ytyrs, am reborn again, and the fire of my rebirth shall send you eternally to the side of your cursed burning god!
2296|1273|1|0|Bow to Bertoxxulous!...  Argh... Kill me...  Please...
2297|1273|3|0|Argh!...  Mer...  o... na...  it's...  not...  your fault...  arhhh...
2298|1274|3|0|I do not think the patrons of the Grub N' Grog are going to take a liking to your evil deed.
2299|1275|1|0|Ha! You are not going to be able to stop me from poaching!
2300|1276|7|2|Grrrraaaaarrrrrg! The stench of fear permeates the walls of this city! I will forge one item for the faithful of our Lord Cazic-Thule! Make haste!  My time here is short!
2301|1277|3|0|Crakneks will smoosh you!
2302|1278|1|0|I shall show you the pure fury of the Dead!
2303|1278|3|0|Soon you shall learn the extent of the Dead's power. Vengeance shall be theirs.
2304|1279|3|1|crumples into a shapeless heap, clouds of spores marking its death. A hugh pitched keening sound echoes throughout the caverns.
2305|1280|1|0|What do you think you are doing?!?
2306|1280|3|0|My death as well as Ember's will be avenged!  The people of Rivervale will hear of this!
2307|1281|1|1|clicks and hisses in rage.
2308|1281|3|1|looks up at you and squeals pitifully.
2309|1282|1|0|Oooohhh... Arghhh... Yooouuu sssshhhalll neeeveer ffffiiinnnd the paaawwww...
2310|1282|3|0|Aaaatt laaasssssstttt! Opolla's cuuurrsssee is lifted!
2311|1283|1|0|HAH! Someone as weak as yourself wouldn't even make a decent slave! You're better off dead, I say!
2312|1283|3|0|You may have won this battle, my friend, but I shall rise again... and one day, all shall know the true power of the Burning Dead!
2313|1284|1|0|You will never take me alive!!
2314|1284|3|0|hisss.. You will never stop the.. Radiant.. Green..
2315|1285|1|0|HELP ME MINYUNS! DA POWA OB DA BOOK COMMANDS IT!
2316|1285|3|0|My comrades will avenge my death.
2317|1286|1|0|Troopers! Help!
2318|1286|3|0|All Iksar residents... shall learn... of my demise. Ungghh!
2319|1287|1|0|Bladestorms!  Remove these trespassers from my island!
2320|1288|1|0|Oh! You're in big trouble now! We don't like intruders trying to kill us! Time for you to die, $name!
2321|1289|1|0|How dare you! You attack us after we allow you to enter our domain in peace? Time for you to die!
2322|1290|1|0|Attackers must die! The Lunatic bids it!
2323|1290|3|0|My comrades will avenge my death.
2324|1291|4|0|So you have awakened me!  It seems my brother was not much of a challenge.  Before we get on to business, there are some matters that must be addressed.  But enough talk, let's address these matters first.
2325|1292|1|1|is not fully developed.  It needs a host body to feed upon. Yours!
2326|1293|1|0|Join.. Glug.. Tombor in his.. watery grave!!
2327|1293|3|0|My map!! You have my.. map.
2328|1294|1|0|None shall defile the realm of our master!
2329|1294|3|0|Innoruuk, I have failed you!
2330|1295|1|0|Hold still, this will only hurt for an eternity!
2331|1296|1|0|Uninvited guests to our master's home must be shown the way out!
2332|1296|3|0|Perhaps this death will release my soul from this accursed place.
2333|1297|1|0|Die!
2334|1298|1|0|Eeeaiiiiiiiiiiiiiieeeee!
2335|1298|3|1|spurts foul smelling blood, and is still.
2336|1299|1|0|I shall slow your heart and shatter your soul!
2337|1299|3|0|Careful which paths you follow in life, mortals!  Fill yourself with hate and you will become a tool of Innoruuk.
2338|1300|1|0|You should not have come within my grasp! My widows will trap you in their webs and feast on your blood!
2339|1301|1|0|Come! Let me flay your skin!
2340|1302|1|0|Come feel the unholy power of Innoruuk!
2341|1303|1|0|Kill! Kill! Kill! For Queen Cristanos!
2342|1304|1|0|Heretic! The power of Innoruuk shall smite thee!
2343|1305|1|0|Prepare to be gutted like a fish.
2344|1306|1|0|Your head will make a fine trophy in the halls of the Indigo Brotherhood.
2345|1307|9|0|Tone deaf fool, you have no ear for rhythm, and deserve this death.
2346|1307|3|0|The dance is over, for now.
2347|1308|1|0|Feel the rage of our master!
2348|1308|3|0|This is no victory for you!  Your hate grows with every kill!
2349|1308|9|0|One less foe to trouble our lord and master!
2350|1295|9|0|Don't you just hate when that happens?
2351|1296|9|0|If you are lucky, you will stay dead.  If you are not lucky, you will become as we are!
2352|1309|1|0|Hssst.  Foolish mortal!  You can not kill the dead!
2353|1309|9|0|Die!
2354|1310|1|0|I shall defeat you with my superior skill and style!
2355|1310|3|0|My form was weak, your style was excellent.  I hate you!
2356|1310|9|0|You are weak!
2357|1297|9|0|Die!
2358|1298|9|1|shivers in anticipation of its next meal.
2359|1311|1|0|You are almost beneath notice, but our master commands your death.
2360|1311|3|1|blinks in confusion, obviously surprised that she has met her end at the hands of mere mortals.
2361|1311|9|1|snorts in contempt, not at all surprised at the ease of her victory.
2362|1299|9|0|Another soul one step closer to our master's touch!
2363|1294|9|0|Embrace our lord before your soul departs, and perhaps he shall grant you the boon of eternal life in his service!
2364|1312|3|0|What?!?  I should have easily evaded that blow!
2365|1313|1|0|You are no match for the Dragoons
2366|1313|3|0|There is no finer death than to fall in battle against the foes of my creator.
2367|1314|3|0|If only I had my pet . . . . .
2368|1315|3|0|Nooooooo!
2369|1315|9|0|Innoruuk will enjoy the taste of your soul
2370|1316|3|0|One day I shall lure you to your doom, but not this day, it seems.
2371|1316|9|0|You knew this was coming, didn't you?
2372|1317|3|2|This is no victory,  mortals!  We shall meet again, and I WILL exact my revenge.
2373|1317|9|2|I feel your rage as your body fights for life.  You feed me well! My children, your father protects you, praise to him!
2374|1318|3|1|shudders violently. The horrid, blood-curdling sound of breaking bones and searing flesh as if upon a scaulding stove generously; suddenly fill the air. The Deathrot Knight's body seems to tear itself asunder within the violent convulsing of its dying, astral form. A final bellowing screech escapes the thing's unnaturally agape, dislocated jaw as it falls to the ground as a heap of torn flesh and muscle, impaled by its own spine and ribs.
2375|1312|9|0|You should have stayed in bed this day.
2376|1319|1|0|eeeeheeeheee!
2377|1319|9|0|Ha ha!
2378|1319|3|0|blearg!
2379|1320|1|1|chants twisted words of hatred.  'You have encroached upon what is mine.  Never will you touch this shield.  You will die here.'
2380|1321|1|1|narrows his eyes and gives a cruel, sinister smirk of delight as he gives a stunning display of grace in readying his blades, 'How marvelous to find one who invites death so openly. Come, let us dance and allow me the pleasure of delivering you unto the hands of the fate you so desire.
2381|1321|3|1|staggers for a moment, his blades dropping from his shaking hands. His eyes wide upon his beautiful, marred face, Fittorin gasps one last breath before crumbling to the ground in a lifeless heap.
2382|1322|1|1|covers a pouch as to something from jumping out. 'You not get lizard! You be squashed!'
2383|1323|3|0|Froooooaa...my neckla...froooaa...
2384|1324|1|0|Grripp... Must not interfere with my mission! Ribbit.
2385|1325|1|0|Sss... Pray to your false deity! Greenmist is upon you!
2386|1326|3|0|You shall now be a wanted man... The Union of Vie shall punish you.
2387|1327|7|0|I'm going to start my patrol. I'll report back by morning.
2388|1328|3|1|yips and falls to the ground. A tattered note appears to be tucked into his armor.
2389|1328|1|1|begins to howl and yip. 'Grrr.. Mad..ness!! Red, sweet red.'
2390|1329|1|1|performs an acrobatic tumble and unsheathes his foil without pause. 'Short, stout and deadly am I. Stand and deliver!'
2391|1330|7|0|Young one, you cannot fathom how long it has been since I breathed air and felt flesh on my bones. I told you I would show you a weapon that would make you the most powerful of your kind. I said nothing of giving it to you. Feast your eyes on Innoruuk's Curse, mortal! Thank you for your service.
2392|1331|1|2|How amusing. You foolish mortals actually think to challenge me? Very well, then, I shall enjoy searing the flesh from your bones!
2393|1331|9|0|Slightly crispy but still tasty, who shall be next?
2394|1332|1|0|Very cute, mortal.  Please, please, don't kill me.  Hah!  Tell me, are you immune to poison?  I certainly hope so.  I am.
2395|1332|3|0|The cannot be!  How did one such as you slay me?  I curse you, your children, and your children's children.  All here will pay!
2396|1332|9|0|Ahah!  What did I tell you, mortal?  As your life slips away, you may hear me laugh at you.  Ha ha, ha ha, ha ha.  There, now you have learned your lesson.  A pity it is far too late.
2397|1333|1|2|Why must you mortals always hunt down my people like dogs!  Let your deaths be a lesson to those who are wiser than to defy the will of Veeshan!
2398|1333|9|0|Another lost soul has found its way home.  I pray you live your next life a bit more wisely.
2399|1334|3|1|is torn in a time lapse.
2400|1335|7|0|I've gotta stop Gragbar before he turns in that report!
2402|1337|3|1|growls at you meanly, then slumps to the floor dead.
2403|1338|1|1|growls and attacks you!
2404|1338|3|1|yelps out in pain and falls to the ground.
2405|1339|1|0|Desist! Who do you think you are hitting with that! There will be consequences to your actions! Hey! Stop that! Ow!
2406|1339|2|1|looks annoyed and indignant for a moment, then falls to the ground dead.
2407|1340|1|1|swings at you with incredible speed!
2408|1340|3|1|curses you as it falls dead.
