id|emoteid|event|type|text
1|1|1|0|Time to die $name.
2|2|1|0|Your bones will be crushed by the Kromzek of Kael Drakkel!
3|3|1|0|Your bones will be crushed by the Kromrif of Kael Drakkel!
4|4|1|1|growls and lunges at you!
5|5|0|1|raises his arms triumphantly.
6|5|1|1|grunts at you and rushes in to attack
7|5|3|1|falls lifelessly to the ground...
8|6|1|0|I will gut you like a fish when I am done.
9|7|1|0|I will show them all that I am a true Kromrif warrior!
10|8|1|0|Watch carefully as I kill this fool, my students!
11|9|1|0|Only a fool would attack a merchant in the city of Kael Drakkel!
12|10|1|0|I will wash my hands of your blood when I am done!
13|11|1|0|You will not live to regret that!
14|12|2|1|staggers, then falls hard to the ground, whatever animating force it possessed now lost.
15|13|1|1|howls and charges!
16|14|1|0|Death to all!!  None shall get the mallet!!  All shall die!!
17|15|1|0|Areeeeewwwww
18|16|1|0|Run!!  Leave this place at once!!
19|17|7|0|Dig! Dig faster, you fools! Our masters say this ghost is all that stands in the way of the great one's return. Uncover his hiding place so that the forces of the Burning Dead might destroy him and recover its legacy!
20|18|1|1|lowers his horn and charges!
21|19|1|0|You have sealed your own fate!
22|20|1|0|You have made your last mistake.
23|21|1|0|How dare you interrupt the games!
24|22|1|0|How dare you take up arms against me!
25|23|1|0|How dare you tread on this holy ground?!
26|24|1|0|You will not defile our temple!
27|25|1|0|You will die a fool's death.
28|26|1|0|Rallos, grant me the power to destroy this fool!
29|27|1|1|waves its arms and gibbers incomprehensibly.
30|28|1|0|You are not welcome in Tunares sacred lands!
31|29|1|1|emits a high-pitched screech and dives with its claws extended.
32|30|1|0|The branch has been broken and now shall be burned.  Your ashes shall join the intricate tangle of tales carried by the winds.
33|31|1|0|Puny creature, feel the might of the Kromrif as I crush you into mortar for our walls!
34|32|1|0|Heretic!  Dare you enter our sacred halls?  Your crimes shall not go unpunished.  You shall die for your deeds.
35|33|1|0|More souls for the mistress.
36|34|1|0|The might of the oceans is at my command, and with it I shall end your existence, strange one!!
37|34|4|0|I can't wait till the warriors take us out for a swim in the bay!  They say it is too dangerous for us to go out ourselves because of the sharks, buthar, sirens, and that nasty sea dragon Kel...Kelo...Kelorek'Dar.
38|35|1|0|The might of the oceans is at my command, and with it I shall end your existence, strange one!!
39|35|4|0|We must continually give praise to the great Prexus for the blessings he has bestowed upon we Othmir!  It is because of our devotion to the Ocean Lord that our shores will never fail to yield a rich harvest of shell fish!
40|36|1|0|The might of the oceans is at my command, and with it I shall end your existence, strange one!!
41|36|4|0|Welcome strange one! I am on watch duty so I'm afraid I have not the time to converse. Perhaps when my shift is over we can exchange words over a bowl of spicy clam chowder.
42|37|1|0|The might of the oceans is at my command, and with it I shall end your existence, strange one!!
43|38|1|0|The might of the oceans is at my command, and with it I shall end your existence, strange one!!
44|38|4|0|Excuse me, strange one, for my rudeness, but I must finish collecting the shellfish for tonight's feast in time for them to be properly prepared.
45|39|1|1|begins singing an eerie enchanting song that numbs your senses and clouds your mind.
46|40|1|0|Ugly creature near my feet, me thinks that you'll be good to eat!
48|41|1|0|Time to mine fer yer brains!!
49|41|3|0|Aaargh!!  The picks of Mining Guild 628 shall avenge my death.
50|42|1|0|You have trespassed long enough on Sabertooth land!
51|43|1|0|Grrrr..  <Barkk!!>  No get..  stout!!
52|44|1|0|YAP! YAP! YAP! In the way of my father, I claim your blood for the glory of Blackburrow!! WOOOOOOOF!!
53|45|1|0|Grrr..  <Ruff!!> <Bark!!> <Bark!!>  You'll not get him!! 'A baby's cry can be heard coming from his backpack'
54|46|1|0|In the name of the Rainkeeper, I strike at thee!!
55|46|3|0|You will meet your own doom soon enough, my friend.. my influence with the Knights of Thunder is great, and they will not rest until I am avenged!
56|47|9|0|For the glory of Kaladim!! You are no more.
57|47|1|0|For the glory of Kaladim, have at thee!!
58|47|3|0|My brothers of the Stormguard shall avenge me!!  Your days are numbered!
59|48|1|1|hisses and strikes!
60|49|1|0|Guards!!  Guards!!
61|49|3|0|My comrades will avenge my death.
62|50|1|0|Let me release your soul.
63|50|3|0|Your destiny lies at the hands of the Greenbloods.
64|51|1|0|Die, like a motherless gnoll!
65|51|3|0|My comrades will avenge my death.
66|52|1|0|The blades of the Butcherblock Bandits do not discriminate!!
67|52|3|0|You shall soon feel the daggers of the Butcherblock Bandits upon your back!!
68|53|9|0|Yet another victory for Kaladim and the Bloodforge Brigade!
69|53|1|0|Now you shall know the skill of a member of the Bloodforge Brigade!!
70|53|3|0|My brothers of the Stormguard shall avenge me!!  Your days are numbered!
71|54|1|0|Death!! Death to all who oppose the Crushbone orcs!!
72|54|3|0|You shall have all the Crushbone orc legions on your tail for my death!
73|55|1|0|Ahhh, money in the bank!
74|56|1|0|Cease and desist!!
75|56|3|0|You have not won.  Consider yourself wanted by the Legion of Cabilis.
76|56|9|0|Another victory for the Legion of Cabilis.
78|57|1|0|Hiss..  You cannot hope defeat a Crusader of Greenmist!!
79|57|3|0|Ha ha!!  Fool..  The Crusaders of Greenmist shall torture you to death!!  Ha ha!!
80|58|1|0|Fear the blades of the Iksar!!
81|58|3|0|You have not won.  Consider yourself wanted by the Legion of Cabilis.
82|58|9|0|Another victory for the Legion of Cabilis.
84|59|0|0|You are nothing compared to the dark power of the Brood of Kotiz.
85|59|1|0|Begin your prayers, young simpleton!!  Your time on this realm has expired.
86|60|1|0|Troopers!!  Help!!
87|60|9|0|Imagine that!!  A simple Iksar resident defeating an adventurer.  Ha!!  You should have stayed at home and become a humble merchant.  Fool!!
88|61|1|0|The time has come to do you in, to demonstrate the power of Thurgadin!
89|62|1|0|Your blood in the snow will leave a deep stain!  A reminder to all not to cross the Coldain!
90|63|1|0|I'll hack at your knees 'till you fall down!  Out of love for the Dain, for the glory of the crown!
91|64|1|0|Rygorr orcs kill in the snow!  We'll bash in your face and cut off your toe!!
92|65|1|0|You are the weak that we shall cull!  We'll rip off your head and polish your skull!!
93|66|1|0|Crush, maim, kill, and defy!  For dinner tonight, your brains we shall fry!
94|67|1|0|Yer messin with the wrong Coldain, prepare ta meet yer ancestors!
95|68|1|2|Yer messin with the wrong Coldain, prepare ta meet yer ancestors!
96|69|1|0|Take this ya lily livered landlubber!
97|69|9|0|Dead fools tell no tales.
98|70|1|0|We crush you!!  We still be centurions!!
99|71|1|1|glows with power as it begins to chant!
100|71|3|1|convulses on the ground and dies!
101|72|1|1|attacks you with unnatural strength!
102|72|3|1|spins and falls to the ground!
103|73|1|1|attacks with eerie speed!
104|73|3|1|spins and falls to the ground!
105|74|1|1|stares at you for a moment and then attacks!
106|74|3|0|You cannot ssstop the coming of Fear!
107|75|1|0|Your flesssh will ssserve usss well!
108|75|3|1|begins to smolder as smoke and slime pours from its scales.
109|76|1|1|begins to murmur a grotesque incantation...
110|76|3|1|froths at the mouth as it curls on the ground!
111|77|1|1|lunges towards you with a low hiss!
112|77|3|1|crumbles to the ground in a spray of reptilian blood!
113|78|1|1|unleashes a barrage of savage attacks!
114|78|3|1|yells out in pain and falls to the ground!
115|79|1|1|releases a roaring hiss and attacks!
116|79|3|1|hisses and collapses violently!
117|80|1|1|waches your movement for a moment and attacks!
118|80|3|1|scuttles for a moment before curling up!
119|81|1|1|drips venom as it snaps its mandibles at you!
120|81|3|1|crumbles under the duress of your assault!
121|82|1|1|moves towards you with savage momentum!
122|82|3|1|roars and staggers to the ground!
123|83|1|1|babbles incoherently as it attacks!
124|83|3|1|sprays black slime from its wounds and mouth!
125|84|1|1|attacks with incredible precision!
126|84|3|1|drips black fluid from its eyes and mouth.
127|85|1|1|continues to chant as it turns to face you!
128|85|3|1|falls... black slime pouring from its wounds!
129|86|1|0|I can tassste your flesssh!
130|86|3|1|hisses through a mouth full of viscous black slime!
131|87|1|0|Prepare to ssspend an eternity in Fear!
132|87|3|0|I mussst finisssh the ritual!  I mussst reach the void...
133|88|1|1|reaches for you with its viscid tendril!
134|88|3|1|explodes into sticky strands of viscous matter!
135|89|1|1|moves with incomprehensible speed and fluidity!
136|89|3|1|bursts with an acidic splash, causing the ground to smolder!
137|90|1|0|You're not welcome in Freeport.
138|90|3|0|Your name shall be added to the most wanted list of the Freeport Militia!!
139|91|1|0|Stand where you are, scum!!
140|91|3|0|Your name shall be added to the most wanted list of the Freeport Militia!!
141|92|1|0|I shall show you the pure fury of the Dead!!
142|92|3|0|Soon you shall learn the extent of the Dead's power.  Vengeance shall be theirs.
143|93|1|0|You shall bleed!!  All hail the Deathfist!!
144|93|3|0|Aaarrghh!!  The Deathfist shall hunt you down.  My death will not go unnoticed.
145|94|1|0|Centurions!!  Attack!!
146|94|3|0|Aaarrghh!!  The Deathfist shall hunt you down.  My death will not go unnoticed.
147|95|1|0|Come feel the steel of an orc legionnaire!!
148|95|3|0|Aaarrghh!!  The Deathfist shall hunt you down.  My death will not go unnoticed.
149|96|1|0|Your intolerable reputation insults all in this realm!
150|96|3|0|My comrades will avenge my death.
151|97|1|0|There must be hundreds of interlopers in this place of nature, and this one has just crossed paths with terrible fate!
152|97|3|0|Aaaaagh, not like this!
153|98|3|0|Start digging your grave.  The Indigo Brotherhood shall find you.
154|98|9|0|Hardly a worthy adversary.  A member of the Indigo Brotherhood deserves a much better opponent.
156|99|1|0|How dare you!
157|99|3|0|My comrades will avenge my death.
158|100|1|0|Guards!  Guards!  Help me!!
159|100|3|0|My comrades will avenge my death.
160|101|1|0|This one will prevent the invader from going forth.
161|101|2|3|The velium golem crumbles to the floor, broken and no longer useful to the shrine.
162|102|1|0|Guardians, there is an invader amongst us!  We must destroy them!
163|102|2|3|The lifeless velium figure falls to the ground, unable to serve the shrine any longer
164|103|1|0|Foul being, you have trifled with one of the kin and now you will die!
165|103|2|0|My life is extinguished, but my life force will live on to aid the shrine!
166|104|1|0|Make ready, you are about to meet your maker!
167|104|3|0|This atrocity will not go unpunished.
168|105|1|0|Heathen!  Now feel the power of the kin of the shrine!
169|105|3|0|My lord, forgive me for I have failed you.
170|106|1|0|Foolish mortal!  How dare you try to disturb the sanctity of the shrine!
171|106|2|3|The massive wurm corpse falls to the ground with a great thud, no remaining air left in its lungs.
172|107|1|0|You dare question the might of the Shrine!?
173|108|1|0|You are no match for a legionnaire!!
174|108|3|0|You shall have all the Crushbone orc legions on your tail for my death!
175|109|1|0|Pardon me.  Is that my dagger in your back!!
176|109|2|0|You shall soon feel the daggers of the Butcherblock Bandits upon your back!!
177|110|1|0|Centurions!!  Legionnaires!!  Come join the fight!
178|110|2|0|You shall have all the Crushbone orc legions on your tail for my death!
179|111|1|0|AARRGGHH!  Thieves!  Your blood shall run like the veins of velium in these caverns!
180|112|1|0|We have defended these walls against the vermin from below, you will be shown that very same defeat!
181|113|1|0|Natural selection at work.
182|113|3|0|My comrades will avenge my death.
183|114|1|0|bark, bark, bark!!!
184|115|1|0|Broon will crush you like little pumpkin. Bwahaha!!
185|115|3|0|ARGH!! You will pay, tiny thing!! My big brother Droon will make you dead! And if pap Proon gets you.. argh.. you will stain on his feets.. argh.
186|116|1|0|For the glory of Zek!  Attack!!
187|117|7|2|We come for you, fools. Your reign of weakness over the powers of the land comes to an end now!
188|118|1|0|Slay the hairless ones!
189|119|1|0|Squire Wimbley!!  Quickly to my side!!
190|119|3|0|The people of the Plains of Karana will avenge my death!
192|120|4|0|"Hello! Good to meet you. The road ahead is full of all sorts of nasty creatures. If I were you. I would speak with my master. Sir Morgan."""
193|121|1|1|curls his lip and draws his blades in a professional, intimidating quickness, 'You will soon know to regret the arrogance of your ways, little one -- and how unfortunate that your regret will be so short lived in the last seconds of your life.'
194|121|3|1|drops his weapons and gives a brief, muffled growl that sprays a light mist of blood from his lips as he falls dead to the ground.
195|122|4|1|stares in contemplation at the landscape.
196|123|1|0|That's it, swine!  You're outta here!
197|123|3|0|My comrades will avenge my death.
198|124|4|0|Hail! I'd love to stop and chat with ya but I'm running late to an appointment in Freeport with a fletcher interested in my superior wooden shafts.
199|125|1|0|Death to all who oppose Innoruuk's will!!
200|125|3|0|Innoruuk has seen what you have done. His hate, along with the Dismal Rage, will find you.
201|126|1|0|For the glory of the Deathfist Magistrate, your blood shall run!!
202|126|3|0|Aaarrghh!!  The Deathfist shall hunt you down.  My death will not go unnoticed.
203|127|1|0|Ye be messin with the wrong dwarf!  I'll smash ye'r head in like a ripe marr cherry!
204|127|3|0|Argh!  I shall be rewarded in the Kingdom of Brell for my victories over the children of Veeshan!
205|128|1|0|Not even the dragons of Velious can content with my mastery of the elements!  Prepare to meet your fate, fool!
206|128|3|0|No!  It must..not..end..like this!
207|129|1|0|I'll smash you with my savage fists!
208|129|3|0|Ungh.. I go now to join the spirits.
209|130|1|0|For the glory o' the Wolves!!
210|130|3|0|The Wolves o' the North shall track ye down and avenge me death.
212|130|9|0|Fer Halas!! One more victory fer the Wolves o' the North!!
213|131|4|0|H-ha.. H-hai.. Hail!! It is v-v-very.. C-cold out here. You sh-sh-should light a c-c-campfire.
214|132|1|0|Great Tribunal, help me to smite this foe!!
215|133|1|0|You dare insult an IceBear?!
216|134|4|0|Brrrrrr!! Grr.. Grreetings. It is freezing out here!!
217|135|1|0|Orc stomp, orc kill - orc weapons, your blood will spill.
218|135|3|0|Argh! Clan Deathfist will spill blood for my death!
219|136|1|0|Eeeeeraaaaaaawwwwwwwk!
220|137|1|0|You should not have dared!
221|137|3|0|You will pay, and pay dearly, for this.  The Claws will exterminate you.
222|138|1|0|I have no time for this foolishness!  Die quickly, so that I may continue my search.
223|138|3|0|My son, I have failed you!
224|139|1|0|Why do you even bother to challenge our power?  You can not win.
225|139|3|0|How?  How did you defeat me?  Perhaps the Claws were right?  Mother Veeshan, forgive my foolishness!
226|140|1|0|Oh ho!  The insects try to sting me!  I shall dine well this day!
227|141|1|0|Bouncer smash you!!
228|141|9|0|Ha!! Bouncers best. I am victorioo.. Victer.. I win!!
230|142|1|0|Errrrrr.  Die soft skin!
231|143|7|1|materializes before you. It seems to make a quick appraisal of you before fading from your sight.
232|144|1|0|Halt!!  Who goes there?
233|145|1|0|Stand where you are, scum!!
234|145|9|0|Let your death be a warning to all who dare oppose the Freeport Militia!
236|146|1|0|You're not welcome in Freeport
237|146|9|0|Let your death be a warning to all who dare oppose the Freeport Militia!
239|147|1|0|Die, dog!!
240|147|3|0|You shall never get my testimony. I shall fight you from the grave!! Ha Ha Ha!! You cannot stop the undead!! Foolish mortal!! Your foul deeds have earned my contempt.
241|147|9|0|Let your death be a warning to all who dare oppose the Freeport Militia!
243|148|1|1|smacks the flat of his blade against the palm of his hand and says, 'You want a taste of this, $name?!!'
244|148|9|1|smirks and shakes his head.  'That's what you get for messing with the Freeport Militia!!'
246|149|1|0|That was not a very intelligent thing to do.
247|149|3|0|There is no place to hide for one who slays an arcane scientist.
248|150|1|0|Prepare to bleed!!
249|151|1|1|rattles and strikes!
250|152|1|1|gnashes its translucent mandibles.
251|152|3|1|is motionless, trapped in this reality.
252|153|1|1|moves inward ready to strike.
253|153|3|1|pitches forward, clutching his wounds.
254|154|1|1|begins to clatter.
255|154|8|1|clatters and shakes!
256|155|3|1|clatters to the ground, finally at rest.
257|155|1|0|WHO DISTURBS OUR REST?
258|156|1|0|Tiktakiyiyiyi!
259|156|3|0|ai...yiyiyiyiyi....erp!
260|157|1|0|Aiyiyiyiyiyiyi!
261|157|3|0|ai...yiyiyiyiyi....erp!
262|158|1|1|seeks your flesh.
263|158|3|1|is still, but there are always more to take its place.
264|159|1|1|erupts, loosing a swarm!
265|160|1|1|has decided to feed on live meat.  Yours.
266|160|3|1|flaps its huge wings one last time, then is still.
267|161|1|1|gives an unearthly hiss and attacks!
268|161|3|1|writhes, releasing its grasp on order, dissolving into entropy
269|162|1|0|Yitititi!  Look!  Aiyi, maka rik ro ne vis ka Vaniki!  Someone dares challenge Vaniki!
270|162|3|0|yiyiyi...Vaniki sa mo nis raka ma. aaaah...Vaniki dies, but so do you!
271|163|1|0|Viyiyiyi!
272|163|3|0|poit....narfnarf...erp!
273|164|1|0|Wikiwikiwiki!
274|164|3|0|Neeeeeeeee........
275|165|1|0|Vaka ral na ve rikari wili Paebala!  Die, for the Paebala must live!
276|165|3|0|Bata atnaza Paebala Neb'ri ! Bata vetari na ve, Paebala?. I am no longer Neb of the living, I die!  Who shall lead the Paebala now?
277|166|1|0|That wasn't a very intelligent thing to do.
278|166|4|0|Hail. I am in a bit of a hurry. Please excuse me.
279|167|1|0|I have friends in very high places!!
280|167|3|0|You have no idea what a big mistake you made. Either my fellow rogues shall find you or the Freeport Mi.. Unnnghh...
281|168|1|1|howls and lunges for your throat
282|169|1|1|growls and attack you.
283|170|1|0|Die like the dog you are...
284|171|1|0|Brell guide my hammer!
285|172|1|0|For the glory of Thurgadin!
286|173|1|1|roars as it tosses back its head and attacks you
287|174|1|1|calls for help as it swings at your head
288|175|1|0|Prepare to die!
289|175|3|0|Start digging your grave.  The Indigo Brotherhood shall find you.
290|176|1|0|You have made a big mistake choosing to battle a high member of the Circle of Unseen Hands. Now you shall pay!!
291|176|3|0|Big mistake, my friend!! The Circle of Unseen Hands shall surely find and cut you down for the death of the nephew of Renux Herkanon. My bodyguards will be waiting for you!!
292|176|4|0|I do not desire any company other than my bodyguards. Be off!!
293|177|9|0|For the protection of all Fier'Dal, there shall be no mercy for your kind.
294|177|1|0|For the defense of Kelethin!!
295|177|3|0|Your name shall be added to the Guards of Faydark's most wanted list.
296|178|1|0|Frrroooaaakkk!
297|179|1|0|Do you wish to exist in darkness?  I can be arranged.
298|180|1|0|Your blood shall slain the stones at your feet, mortal.
299|180|2|0|There is no finer death than to fall in battle against the foes of my creator.
300|181|1|0|None shall defile the realm of our master!
301|181|2|0|Innoruuk, I have failed you!
302|182|1|1|hisses and lunges toward you.
303|182|2|0|NOOO!
304|183|1|0|Uninvited guests to our master's home be shown the way out!
305|183|2|0|Perhaps this death will release my soul from this accursed place.
306|184|1|0|How dare you violate this sacred place, you shall rot!
307|184|3|0|Where am I?
308|185|1|0|I shall defeat you with my superior skill and style!
309|185|2|0|My form was weak, your style was excellent.  I hate you!
310|186|1|0|hold still, this will only hurt for an eternity.
311|187|1|0|My mother taught me not to play with my food, but what fun is that?
312|187|3|0|What?!?  I should have easily evaded that blow!
313|188|1|0|Feel the rage of our master!
314|188|2|0|This is no victory for you!  Your hate grows with every kill!
315|189|1|0|Hatred is the only truth.
316|189|3|0|This is no victory for you!  Your hate grows with every kill!
317|190|1|1|snaps at you.
318|190|2|1|screeches and lays broken before you.
319|191|1|0|You have chosen opponents most unwisely, I am at utmost power in this place!
320|191|3|0|I fall, but Innoruuk shall prevail!
321|192|1|0|Be gone defiler!
322|192|3|0|My soul serves Innoruuk!
323|193|1|0|Die!
324|193|2|1|sags to the ground, defeated.
325|194|1|0|You are almost beneath notice, but our master commands your death.
326|194|2|1|blinks in confusion, obviously surprised that she has met her end at the hands of mere mortals.
327|195|1|0|Eeeaiiiiiiiiiiiiieeeee!
328|195|2|1|spurts foul smelling blood, and is still.
329|196|1|0|You have some nerve!
330|196|3|0|One day I shall lure you to your doom, but not this day, it seems.
331|197|1|0|I shall slow your heart and shatter your soul.
332|197|2|0|Careful which paths you follow in life, mortals!  Fill yourself with hate and you will become a tool of Innoruuk.
333|198|1|0|Welcome to the realm of Innoruuk, I expect to enjoy your stay!
334|198|2|0|Fill yourself with hate and you will become a tool of Innoruuk.
335|199|1|0|How dare you attack a member of the Qeynos Guard!!
336|199|3|0|Fool!!  I was sent by the Commander of the Qeynos Guard.  You will surely be punished..unggh!!
337|200|1|0|That was not a very intelligent thing to do.
338|201|1|0|Grraahh!  Must destroy all who set foot in orc territory!!!
339|202|1|0|Argg!!!  This is now orc territory and all trespassers must DIE!!!
340|203|4|0|Yeah. hello. I'm Prak. co-owner of the Golden Rooster. If you're thirsty. we have some great imported ales at our bar. If you're looking for a little excitement. try your hand at a little King's Court. We aim to please. my friend.
341|204|1|1|drifts threateningly toward its enemies.
342|204|2|1|wails as his corpse is torn free
343|205|1|1|creates a monstrous shadow as it approaches.
344|205|3|1|fills the air with a hollow thud as it falls.
345|206|1|1|charges ahead with a dreadful fury.
346|206|3|1|collapses and makes a deep impression in the ground
347|207|1|1|thunders forward with an unstoppable force.
348|207|3|1|falls to the ground with a deafening crash.
349|208|1|1|grinds as it unfurls its stone wings and attacks.
350|208|3|1|cracks and fractures into still jagged stone.
351|209|1|1|makes the ground shake with deadly intent.
352|209|3|1|cracks and splinters into massive sheets of ore.
353|210|1|1|shouts in a shrill voice as it lunges to attack, 'Defeat the invaders!  They seek to invade our lair!'
354|210|3|1|let's out a loud squeak as it falls to the ground.
355|211|1|1|hobbles ahead with a menacing mossy grin.
356|211|3|1|breaks apart into an uneven loamy clod.
357|212|1|1|outstretches its arms and aims to crush your skull.
358|212|3|1|collapses into a heap of grimy dirt.
359|213|1|1|rushes forward as dirt sprays off its limbs.
360|213|3|1|crumbles into broken earth.
361|214|9|0|Those who play with da Basher always gets bashed good!!
362|214|1|0|I shall pluck you limb from limb!!
363|214|3|0|Curse you!! Da bashers will have yer head.
364|215|1|0|To the Overworld with you, foul beast!  The House of Odon is upon you!
365|216|1|0|What sport it shall be to hunt you. Run, while you can!
366|217|1|0|None shall flee from the might of House Legola!
367|218|0|0|Let no evil beings stand in the way of the righteousness of the Paladins of Tunare!
368|218|1|0|Run!!  I have need of the hunt!!
369|219|1|0|Pargh!  Lynuga not like you!  Lynuga squish you!
370|219|3|0|My clan brothers of Broken Skull Rock will make you pay for this!!
371|220|1|0|Die!! Another trophy for the House of Funter!!
372|221|1|0|The hand of the House of Ostodl shall cut you down.
373|222|1|0|Foolish being!! You dare attack a Deepwater knight!!  You shall perish for such audacity!
374|223|1|0|The end is near!! Prepare to die!!
375|224|1|0|Your head shall make a fine trophy upon my mantle!!
376|225|1|0|Grrrrr. Bark. Bark. Grrrrr.
377|226|1|0|Rrr!  Kejaan guide my claws!  You disturrrb our peace no more!
378|227|1|0|Rrrrrr.. I rrremove you from ourrr peaceful island!
379|228|1|0|Furless fool.  I will show you what I have learned in my years!  Kejaan guide my hand!
380|229|4|0|Rrrrrrrr...
381|230|1|0|Leave ourrr island now!  Or you will be rrremoved in pieces!
382|231|1|0|Grrrreeeoww!!!  I shall gut you like a fish for your vile ways!!
383|232|1|0|Rrrrrowwrrrr!!  For the great spirit of our ancestor, Kejaan, I shall rid our lands of your vile presence!
384|233|1|0|<Bark!> Grrrr!
385|234|1|0|Guards!  Come smash!
386|234|3|0|My comrades will avenge my death.
387|235|7|0|Grrrrrrrrrrrrrrrrrrrrrrrrrrrrrrrrrrraaaaaaaaaaaaaaaaaaaaaaaaaaaaah!
388|236|7|0|I will not fail my master this time!
389|237|1|1|growls fiercely, saliva foaming around its ferocious, jagged maw, 'This is our home now!  Begone, or the legions of TomEar shall slay you all'
390|237|3|0|My comrades will avenge my death.
391|237|9|0|Bbbaarrrrkkk!!!  Another intruder has fallen at the hands of the TomEar.  Who is next to fall?  HHhhooooowwwLLLL!!!
393|238|1|0|Hail.. Prime.. Healer!!
394|238|2|0|Temple.. Life.. Get you!!  Yes..
395|239|7|0|Diiiiiiieeeeeeeeeeeeeeeeeeeeeeeeeeeeeeeeeeeeeeeeeeeee!
396|240|1|0|Dark magic, aid me in slaying this fool!!
397|240|3|0|A fallen heretic shall be avenged by dark magic.
