id|emoteid|event|type|text
3166|829|9|1|cackles gleefully for a moment but is soon overcome with a violent coughing fit.
3167|1684|1|1|bites at your hand.
3168|1684|3|1|curls into a ball as its tail shrivels.
3169|1685|1|1|bites at your hand.
3170|1686|1|3|You narrowly escape as a pungent smelling rodent lunges at you.
3171|1686|3|1|takes a bite at you with its last breath.
3172|1685|3|1|dies as it tries to scurry away.
3173|1687|1|0|You will not be permitted to defile this sacred place.
3174|1687|3|1|shows a flash of anger before its eyes dim and it falls to the ground.
3175|1687|9|0|I will feast on your decayed remains.
3176|824|9|1|chitters indifferently as a new corpse falls to its feet.
3177|1688|1|3|You hear a clicking sound as an Arachnae lunges toward you.
3178|1688|3|3|An arachnae aster's corpse's carapace splits as it falls dead.
3179|1689|1|1|clitters at you and draws its mandibles.
3180|1689|3|1|stills as it falls dead.
3181|818|9|1|clitters in victory.
3182|825|9|1|chitters indifferently as a new corpse falls to its feet.
3183|1690|1|1|spits venom at you as it notices you approach.
3184|1690|3|1|stills as it falls dead.
3185|1690|9|1|begins to wrap $name in webbing.
3186|1691|1|1|clitters at you and draws its mandibles.
3187|1691|3|1|oozes a clear liquid as it stops clicking and falls still.
3188|1692|1|1|spits venom at you as it notices you approach.
3189|1692|3|1|oozes a clear liquid as it stops clicking and falls still.
3190|1692|9|1|chitters indifferently as a new corpse falls to its feet.
3191|823|9|1|begins to wrap $name in webbing.
3192|1693|1|1|realizes there is no retreat and throws itself at you.
3193|1693|3|1|tries to squirm away, then falls still.
3194|826|9|1|looks pleased with itself.
3195|1694|1|0|You leave, this Bubonian land!
3196|1694|3|0|I escape Tarkiz now...
3197|1694|9|3|A bubonian cronie shouts, 'I kill, that make you happy master?'
3198|827|9|1|looks pleased with itself.
3199|1695|1|1|lunges at you, tring to protect its master.
3200|1695|3|1|dies as it tries to scurry away.
3201|817|9|1|howls triumphantly.
3202|833|9|0|That was too easy, it has been so long since I've had a real challenge.
3203|828|9|3|A diseased bubonian shouts, 'I kill, that make you happy master?'
3204|1696|1|1|twitches its whiskers angrily as it notices your presence.
3205|1696|3|1|coughs and sputters before falling dead.
3206|831|9|1|clicks indifferently as $name falls at its feet.
3207|1697|1|1|swoops at you.
3208|1697|3|3|You turn your face away as a disease ridden cloud rises from the corpse at your feet.
3209|1697|9|1|flaps its wings happily, having defended its territory.
3210|821|9|1|marks $name as its own, for later consumption.
3211|834|9|0|Now you know the power that Bertoxxulous grants us.
3212|816|9|1|throws a crude knife into the body.
3213|1698|1|1|clitters at you and draws its mandibles.
3214|1698|9|1|chitters indifferently as a new corpse falls to its feet.
3215|1699|1|1|slashes at you with its forearms.
3216|1699|3|1|spins in small circles as it drifts to the ground.
3217|1699|9|1|pauses for a moment to admire the disease ridden body at its feet.
3218|1700|1|3|You hear a buzzing in your ear grow louder.
3219|1700|3|1|drops slowly as its wings lose the speed to carry it.
3220|1700|9|3|$name falls to the ground, ridden with disease.
3221|811|9|1|flaps its wings happily, having defended its territory.
3222|1701|1|1|swoops at you.
3223|1701|3|1|stops buzzing as it falls lifelessly to the ground.
3224|1701|9|3|$name falls to the ground, ridden with disease.
3225|810|9|3|$name falls to the ground, ridden with disease.
3226|837|9|0|Your soul will never find rest, in this world or the next.
3227|813|9|0|I serve Plaguebringer! See I do good master!
3228|822|9|3|$name is covered with dark filth as it sinks into the mirky ground.
3229|1702|1|1|bubbles and sputters as it oozes toward you.
3230|1702|3|1|stops bubbling as it falls dead.
3231|1702|9|1|marks $name as its own, for later consumption.
3232|1703|1|0|You not belong! We kill you!
3233|1703|3|0|Me not ready to die yet!
3234|1704|1|1|looks at you angrily, a foul odor escaping the open sores in its flesh.
3235|1704|3|1|approaches death, succumbing to injuries and disease.
3236|1704|9|0|Ha ha ha! I crushed you!
3237|1705|1|1|beats its chest as it throws itself at you.
3238|1705|3|1|stops chanting as it breathes its last breath.
3239|1706|1|1|notices your presence and lunges at you.
3240|1706|3|3|You wipe bits of goo from yourself as the creature dies at your feet.
3241|814|9|1|marks $name as its own, for later consumption.
3242|805|9|1|spits enzymes onto the corpse as it falls to the ground.
3243|1707|1|1|flaps its wings as it flies at you.
3244|1707|3|1|spins in small circles as it drifts to the ground.
3245|1708|1|1|looks at you hungrily through multifaceted eyes.
3246|1708|3|1|spins in small circles as it drifts to the ground.
3247|1708|9|1|pauses for a moment to admire the disease ridden body at its feet.
3248|806|9|1|spits enzymes onto the corpse as it falls to the ground.
3249|1709|1|1|turns toward you, baring its rotting teeth
3250|1709|3|1|smiles at you, happy to be released from its pain.
3251|1709|9|0|I serve Plaguebringer! See I do good master!
3252|840|9|0|There is honor in your death, but it is your death none the less.
3253|835|9|0|Your death adds to Bertoxxulous' power.
3254|839|9|1|reaches out with its hand feeding briefly on the newly created soul.
3255|1710|1|1|notices your presence and lunges at you.
3256|1710|3|1|stills and sinks into the wet ground.
3257|1710|9|1|marks $name as its own, for later consumption.
3258|1711|1|0|Resnak gonna hurt you!
3259|1711|3|0|Rythak, why you no help!?!
3260|1712|1|0|What? Who you be? No matter, time to die!
3261|1712|3|0|You kill me, but Bubo bigger and him kill you!
3262|812|9|0|Yuuz die so Grimror keen go bak ta wurk!
3263|1713|9|0|Time to sleep!
3264|1713|1|0|Your nightmare has just begun!
3265|1714|1|0|Quellious teaches us understanding and compassion. I'd like you to understand my fists of eternal compassion!
3266|1714|2|0|Kerasha!  I shall see you again!
3267|1715|1|0|Ohh, my mother will be mad at you!
3268|1715|3|0|The... Trees... They...  nooooo!
3269|1716|1|1|issues a deep rumbling laugh as his branches descend to club the life from you.
3270|1716|3|3|An eerie silence settles onto the forest as Deyid the Twisted slumps over, defeated.
3271|797|9|1|bares its fangs and begins to feed!
3272|1717|3|1|'s legs twitch spastically as the final blow is dealt.
3273|1717|9|1|bares its fangs and begins to feed!
3274|796|9|1|swoops down on its victim and starts to feed!
3275|802|9|1|beats its foe into submission and looks about for more
3276|795|9|1|entangles its victim, draining away its essence.
3277|794|9|1|bares its fangs and begins to feed!
3278|798|9|1|tears into your mind, absorbing all your nightmares.
3279|1718|1|1|lunges towards you, clawing at your throat.
3280|1718|3|1|emits one last primal howl.
3281|1718|9|1|bares its fangs and begins to feed!
3282|799|9|1|moves along as if nothing has happened.
3283|1719|1|0|Bah, another come from my brother!?  Well, you will not find me so easy to overwhelm this time!
3284|1719|3|1|gasps and falls forward, a perplexed look etched upon his face
3285|1720|1|1|spiders descend from the canopy above, hungry for flesh
3286|1721|3|0|I have been released from my exile.
3287|1721|1|0|I have no desire to kill anymore, but you leave me little choice.
3288|1722|1|1|opens its large mouth revealing its sharp teeth to everyone around.
3289|1722|3|1|falls lifelessly to the ground.
3290|1722|9|1|roars in triumph.
3291|899|9|1|absorbs the power of its fallen victim.
3292|1723|1|1|erupts into life.
3293|1723|3|1|crumbles back into death.
3294|1723|9|1|absorbs the power of its fallen victim.
3295|1724|3|1|slumps down to the ground.
3296|1724|9|1|absorbs the power of its fallen victim and becomes more powerful.
3297|914|9|1|raises his sword in triumph.
3298|1725|1|0|Leave at once! Before there is bloodshed.
3299|1725|3|0|Mithaniel Marr...I pray to you...
3300|1725|9|0|For the glory of Marr!
3301|1726|1|0|Leave at once! Before there is bloodshed.
3302|1726|3|0|Mithaniel Marr...I pray to you...
3303|1726|9|0|For the honor of the Battalion!
3304|1727|1|0|Leave at once! Before there is bloodshed.
3305|1727|3|0|I die with honor...
3306|1727|9|0|For the honor of the Battalion!
3307|1728|1|0|Leave at once! Before there is bloodshed.
3308|1728|3|0|I die with honor...
3309|1728|9|0|For the glory of Marr!
3310|913|9|0|For the honor of the Battalion!
3311|907|9|1|raises his sword in triumph.
3312|902|9|0|For the glory of Marr!
3313|882|9|1|raises his sword in triumph.
3314|897|9|1|quickly reveals its sharp glass teeth before feasting upon the newly created body.
3315|918|9|1|quickly begins to spin a web around its newest victim.
3316|919|9|1|begins to spray a sticky toxin onto its newly found victim.
3317|917|9|1|roars in triumph.
3318|900|9|1|begins to feast upon the body that has fallen to the ground.
3319|898|9|1|tries to scurry off.
3320|1729|1|1|reveals a set of glass fangs before moving towards its prey.
3321|1729|3|1|falls to the ground shattering into pieces.
3322|1729|9|1|opens its large mouth revealing a full set of razor sharp fangs.
3323|896|9|1|begins to tear away at its fallen victim's flesh.
3324|1730|1|1|issues a small 'reedip!' and charges fort
3325|1730|3|1|expires, leaving a messy stain where it fell
3326|911|9|0|By the might of Marr I strike thee down!
3327|908|9|1|raises his sword in triumph.
3328|912|9|0|For the honor of the Battalion!
3329|909|9|0|For the honor of the Battalion!
3330|1731|1|1|roars loudly in a display of power.
3331|1731|3|1|drops to the ground shattering into small pieces of glass.
3332|1731|9|1|roars loudly in a display of supreme power.
3333|906|9|1|raises his sword in triumph.
3334|905|9|1|raises his sword in triumph.
3335|904|9|0|Your death is not without meaning.
3336|916|9|0|For the glory of Marr!
3337|910|9|1|raises his sword in triumph.
3338|1732|1|0|You dare strike an officer?!?
3339|1732|3|0|Mithaniel Marr...I pray to you...
3340|1732|9|1|raises his sword in triumph.
3341|1733|1|0|You dare strike an officer?!?
3342|1733|3|0|My death is with honor. One day you too will die. Your death will be without honor.
3343|1733|9|0|For the honor of the Battalion!
3344|903|9|1|raises his sword in triumph.
3345|1734|1|1|erupts from the dead.
3346|1734|3|1|crumbles back into death.
3347|1734|9|1|absorbs the power of its fallen victim.
3348|1735|1|3|The fiery, impish creature dashes toward you!
3349|1735|3|3|The corpse of the mephit crackles and splits into three smaller mepheekas!
3350|939|9|0|I was the mightier warrior, there was no other outcome.
3351|935|9|0|Foolish one, you are no match for the might of the Storms of Srerendi!
3352|1736|1|3|The fiery, impish creature dashes toward you!
3353|944|9|0|Froak!
3354|942|9|0|The desert thanks you for your generous contribution.
3355|947|9|0|The Koka`Vor tribe have endured far worse than you.
3356|1737|1|0|So you are the cause of the pain in the trees; now it's your turn for pain.
3357|1737|3|0|The Ancient will be the death of you.
3358|1737|9|0|The Koka`Vor are one with the trees, but you... you are tainted.
3359|945|9|0|Not even as difficult as the worthless Ents.
3360|1683|9|0|This should never have happened.
3361|1680|9|0|Why? Why did this tragedy have to happen?
3362|1738|1|0|This is my fort, you won't take it from me!
3363|1738|3|0|My axe, nooooo...
3364|1738|9|0|I am more powerful than you, isn't that clear?
3365|1739|1|0|Lornu hork sik tuvuluk, rurok juuk doror tok disroruk nok?
3366|1739|3|3|Drowning in defeat, the long lost hero of Lok sinks back into the depths below, now eternally slumbering.
3367|1739|9|0|Drornok Tok Vo`Lok niktu nor dokvor!
3368|1740|1|0|This forest will burn, and you will go with it!
3369|1740|3|3|A surge of lightning shoots forth from Falto's corpse as it crashes to the ground.
3370|1740|9|0|Is it something burning, or is it just you?
3371|938|9|0|Surely you did not think yourself to be bolder than me!
3372|1741|1|0|Grok smoosh!
3373|1741|2|0|Grok no smoosh gud enuf...
3374|1741|9|0|Hah! Grok most strongist smoosher ever!
3375|1742|1|0|Who dares to disturb my desert sands?
3376|1742|3|0|Krendic must not fall to the other tribes!
3377|1742|9|0|The Sands of Chaos have proven themselves this day!
3378|1743|1|0|Fool! You don't really think you'll defeat me, do you?
3379|1743|3|0|Ha ha! You have no idea what you've unleashed.
3380|1743|9|0|Now do you understand that the Srerendi Storms will last evermore?!
3381|1744|1|0|Fool! You don't really think you'll defeat me, do you?
3382|1744|3|3|As the corpse of Jeplak crashes to the ground, you notice a slight, deranged smile on his face.
3383|1744|9|0|Now do you understand that the Srerendi Storms will last evermore?!
3384|1682|9|0|You left me no choice but to slay you.
3385|946|9|0|Compost for the forest, and I hardly broke a sweat.
3386|1745|1|0|Kelek`Vor heed my call, help me defeat this infidel!
3387|1745|3|0|My forest. . . you have failed me. . .'
3388|1745|9|0|Nothing but mulch for the forest.
3389|937|9|0|Surely you did not think yourself to be stronger than me!
3390|943|9|0|Ahh, the wonderful gusting sands have proven their might once again.
3391|1746|1|0|I cannot let you harm the forest!
3392|1746|3|0|Now the forest will burn, and I can do nothing to save it.
3393|1746|9|0|Maybe next time you will choose to help, not harm the forest.
3394|1747|1|0|You have caused enough havoc to the Koka`Vor tribe, prepare to die.
3395|1747|3|3|In an insufferable collapse, the mighty Ancient of the Trees perishes.
3396|1747|9|0|You had thought me weak, but now you understand.
3397|1681|9|0|Such a poor waste of life, I feel for you.
3398|844|9|1|snarls and drives its foot into the now dead corpse, then begins to look for its next victim.
3399|1748|1|0|Welcome to the wretched end of your pitifully weak existences. You shall bow before me and tremble in the awesome power of Decay, in its purest form!
3400|1748|9|0|Hmm, just as I predicted. I shall use your putrid corpse for decoration material.
3401|851|9|0|Yours is a chapter of servitude, welcome to the decay that is your eternal future!
3402|1749|1|0|Foolish well-beings, you have rustled up the decay in me now die!
3403|1749|9|0|Ha ha ha! You didn't really think you'd win, did you?
3404|1750|9|0|Bertoxxulous would be proud, but truly you were not worth the effort it took to slay you. Remember, I am decay's right hand.
3405|1751|1|1|moves toward you with great hostility, a foreboding sense of impending doom prevalent from the noxious fumes emanating from him.
3406|1751|3|3|The immense body collapses to the floor sending shockwaves through the ground as you have triumphed over this maniacal creature of death and decay.
3407|1751|9|0|Join the rest who tasted my fine delicacy of decay!
3408|854|9|0|At last, your efforts have been turned into the death which surrounds you all.
3409|1752|1|1|lets out a shuddering wail as it begins to attack.
3410|1752|3|1|falls to the ground dead. All around the shrieking cries of the summoners of Bertoxxulous are heard.
3411|1752|9|1|rends the lifeless body of another victim.
3412|1753|1|0|The children of Bertoxxulous will show you the death and decay that he brings!
3413|1753|3|3|The essence of decay has been quelled in this being, its lifeless form falls to the ground.
3414|1753|9|0|Fear the reaper of decay, for he will shower you with death.
3415|1754|9|0|Ha ha ha! You didn't really think you'd win, did you?
3416|1755|1|0|Your curse will be the worst of all, a plague to rip your soul from this plane and into the next!
3417|1755|3|0|I go to meet my maker! You have done me nothing more than a great service! Ha ha ha!
3418|1755|9|0|I feel your pain, your suffering; it feeds me like nothing else!
3419|1756|1|0|You die come me give.
3420|1756|3|0|Death comes for all even Kakoo
3421|1756|9|0|You dead now. Who die next?
3422|1757|1|1|buzzes loudly as it moves in to attack.
3423|1757|3|1|shudders again and again and then falls over dead
3424|1757|9|0|BzzzzBzzzz
3425|1758|1|0|By Lxanvom's might, you shall perish this day and be reborn as a death incarnate!
3426|1758|3|0|Bertoxxulous awaits you, and I shall again, for I will be twisted anew to curse you to death!
3427|1758|9|0|Feel the fury of Lxanvom, feel the pain as your body wastes away into nothingness!
3428|1759|1|1|mumbles some gibberish then says 'Fear me you will'
3429|1759|3|0|The death spirit comes to me
3430|1759|9|0|For me victory for you death!
3431|1760|1|0|You want die! I give you die!
3432|1760|3|0|Ah me dead dead! Dead dead!
3433|1760|9|0|You dead dead! Me kill kill!
3434|842|9|0|There is no one who can match my powa!
3435|1761|1|0|The age of the living is far beyond the reach of you, I shall slaughter you with great prejudice!
3436|1761|3|0|This is the end, but it is not over! You will not find solace in my death! Ha ha ha!
3437|1761|9|0|Was there any doubt that I would fulfill your destiny?
3438|848|9|0|Your soul shall be added to my collection.
3439|846|9|0|I will now feed on the lifeforce of your friends.
3440|847|9|0|Wretched fool you now know the power of the Plaguebringer.
3441|1762|1|0|Evisceration coming up!
3442|1762|3|0|Me no want die!
3443|1762|9|1|giggles madly as it slashes up the now dead corpse.
3444|1763|1|0|You worthless pack of slime, you will join your brethren in the depths of decay!
3445|1763|3|0|What has happened? How can this be? Rraarrrgggg. . .
3446|1763|9|0|As I predicted, and no more troubling than a maggot.
3447|845|9|1|cackles with delight as it eyes the dead corpse glowing with magical energy.
3448|1764|1|1|gathers a greenish glow as it motions quickly with its hands. Then looks at you and says, 'Decay, corruption these me be!'
3449|1764|3|1|lets out one last breath as its life force slips away
3450|1764|9|0|You no match for me!
3451|1765|1|0|You dare to challenge the piercing judgment of decay?
3452|1765|3|0|All that power, all that knowledge, lost to a mortal being!
3453|1765|9|0|Feel the deadly sting of eons of experience burning through to your own demise!
3454|1766|1|0|You truly believe you can defeat a creature of such ancient power and knowledge? Fools, all of you!
3455|1766|3|0|You haven't yet been subjected to the ultimate decaying death that awaits you, but you shall soon enough.
3456|1766|9|0|As a wise man once said, 'You are better off dead, if for no other reason than to serve death.'
3457|1767|1|0|Pain for you. Pain!
3458|1767|3|0|collapses to the ground a shocked look on its face.
3459|1767|9|0|No beat Hetral! NO ONE!
3460|1768|1|3|The eyes of the beast glow a bright red, a sense of corroding life burns in your mind.
3461|1768|3|3|The virulent creature slumps to the ground, the decaying mass of flesh nothing more than a pile of debris now.
3462|1768|9|0|You have seen the power of decayed reasoning, now relish it in death.
3463|1769|1|3|The scent of brooding demise encroaches on you as the ancient king bears down upon you and strikes!
3464|1769|3|0|My death only gives Lord Bertoxxulous strength; it is a pleasure to serve him so!
3465|1769|9|3|The beast siphons the freshly deceased life-force into his own, giving him strength.
3466|1770|1|0|Grrawww! Feel the touch of my blade as it strikes down upon you with furious anger!
3467|1770|3|0|My power, my strength... Bertoxxulous will smite you down for this!
3468|1770|9|0|Do you feel the power I wield?!
3469|1771|1|0|Dorwikak Punish! Dorwikak kill!
3470|1771|3|0|WWWHHYYY! Me no die!
3471|1771|9|0|Dorwikak have no match! Me so powah!
3472|1772|1|0|Leave it to the living infidels to trifle with necromantic supremacy!
3473|1772|3|0|Matter over mind, is it? You shant be prepared for Bertoxxulous!
3474|1772|9|0|Mind over matter, in its purest form, is unbeatable.
3475|1773|1|0|Death echo for you!
3476|1773|3|0|Argh me dead now me dead tomorrow!
3477|1773|9|0|Me have good eats now
3478|1774|1|0|What is this? If you have sought to squander your existence, you should have asked!
3479|1774|3|1|gasps a last breath before crumpling to the barren stone floor, his reign of terror now finished.
3480|1774|9|0|Do you now see the error of your ways, attempting to stop the inevitable?
3481|1775|1|0|You have trifled with decay for far too long, now you will die in its recesses.
3482|1775|3|0|This bears the mangled fruits of festering remains, but Bertoxxulous will persevere.
3483|1775|9|0|Only now, in the end, do you understand the true power of rotting maleficence.
3484|1776|3|2|My pretties!
3485|878|9|0|I hope this is a lesson to you! Never disturb an armorer while they are working!
3486|879|9|1|snorts and growls at the corpse lying on the ground.
3487|874|9|0|You consider yourself a challenge? Come back when you have sufficient skill.
3488|873|9|0|Your death had no meaning here, just another corpse laid upon the piles.
3489|876|9|1|releases a war cry unlike any other you've ever heard, obviously taking pride in its victims death.
3490|877|9|1|snorts and growls at the corpse lying on the ground.
3491|875|9|1|extends its arm toward the corpse, tearing the spirit from the lifeless husk.
3492|880|9|1|soars into the air once again, searching for another target.
3493|1777|1|0|Troopers!!  Help!!
3494|1777|3|0|My comrades will avenge my death.
3495|1778|1|1|raises his axe over his head as the fire of war slithers across the blades.
3496|1778|9|1|laughs in an ominous tone of death.  'Flee whelps! Flee before the might of the Warlord!
3497|1779|1|1|screams in fury as his blade flies across the field of blood.
3498|1779|9|1|laughs in an ominous tone of death.  'Flee whelps! Flee before the might of the Warlord!
3499|1779|3|1|falls to the ground sending a tremor across the bloodied ground of the arena.  The black armor around the corpse begins to crack and shatter.
3500|1780|1|1|draws back his bow as ethereal energy forms into barbs of death.
3501|1780|3|1|evaporates into ethereal mists.
3502|1780|9|1|pins a corpse to the wall with a barb from his bow. 'The boars will enjoy that later.'
3503|1781|1|0|Enjoy your final moments mortal!  You can not defeat the armies of Zek!
3504|1781|3|1|falls to the ground. His great bow clatters across the stone floor and evaporates into nothingness.
3505|1781|9|1|pins a corpse to the wall with a barb from his bow. 'Glykus said he was hungry.'
3506|1782|1|1|chuckles softly as a sly grin crosses his face.
3507|1782|9|1|laughs quietly. 'Pathetic really.'
3508|1783|1|1|grins as a black cloud begins to swirl around his obsidian blade.
3509|1783|3|1|cries out as he falls to the ground.  His obsidian scimitar clangs against the floor of Drunder and shatters into a thousand pieces.
3510|1783|9|0|You can not stop us mortals.  Eternity belongs to the house of Zek!
3511|1784|9|1|laughs quietly. 'Pathetic really.'
3512|1784|3|1|dissolves into shadows.
3513|1785|3|1|dissolves into shadows.
3514|1786|1|0|Stupid fools! Leave us be!
3515|1786|3|0|Why did you have to hurt me so bad? I didn't do anything to you...
3516|1786|9|1|searches through your pocket before your body hits the ground.
3517|883|9|1|taps its sword onto his chest and bows briefly.
3518|891|9|1|roars in triumph.
3519|888|9|0|You were no match for a warrior of Marr!
3520|884|9|0|For the honor of Ducee Inston!
3521|889|9|0|You have fallen to the might ot Alto Bellumon.
3522|890|9|0|Your death will be remembered as a futile challenge against the Alto Roburon.
3523|1787|1|1|readies himself for the upcoming onslaught.
3524|1787|3|1|falls to the ground as the blood begins to pour out...
3525|1787|9|1|spits on your body before attacking its next victim.
3526|1788|1|0|These tombs carry our fallen heroes, and you dare desecrate them ? Prepare to die!
3527|1788|3|0|I have failed Mithanial Marr. My death was honorable, but I fear it will not please him...
3528|1788|9|0|You have fallen honorably at the hands of the tomb guardians. Your death will be a message to all who dare desecrate these sacred tombs.
3529|893|9|1|roars in triumph.
3530|885|9|0|For the honor of Ducee Inston!
3531|886|9|0|For the honor of Ducee Imperon!
3532|1789|1|0|You dare assault Mithaniel Marr? You shall pay in blood for your treachery!
3533|1789|3|0|Your strength of will is astounding, I can only hope my death was not in vain.
3534|1789|9|0|You did not stand a chance against the Champions of Marr!
3535|1790|1|0|So you've come to challenge the might of Marr? Your death will be with honor!
3536|1790|3|1|slumps down to the ground in defeat.
3537|1790|9|1|rises his sword in honor as another falls before the might of Marr.
3538|894|9|0|The honors of victory are mine. Perhaps your death will be a message to all who wish to challenge Mithaniel Marr.
3539|1791|3|3|The storms surrounding Agnarr grow silent for a moment before erupting into a violent fury. They then calm as suddenly as they erupted.  Small swirls of wind and power dance over Agnarr's body as his last breath escapes his lips.
3540|1791|9|1|chuckles, 'Chaos rain is supreme.'
3541|1792|1|0|There has been enough violence! Don't make me add you to the corpses at my feet.
3542|1792|3|0|Rainkeeper, I have failed you again.
3543|1792|9|1|weeps as another body falls to the ground.
3544|1793|1|0|Tiny creature, you shouldn't meddle in the affairs of The Kuraaln.
3545|1793|3|1|'s eyes glow brightly, then fade as it falls to the ground.
3546|1793|9|1|consumes a corpse with pure energy.
3547|1794|1|1|focuses his attention to you, causing all the hairs on your body to stand on end.
3548|1794|3|0|You fought well, I hope you burn.
3549|1794|9|0|That was invigorating, I hope there is more fighting to do!
3550|1795|1|0|Now you will die by the mightiest of the Volaas.
3551|1795|3|3|The winds in the room calm as $mname hits the ground.
3552|1795|9|0|Now it is too late, it is a shame you could not have learned sooner.
3553|958|9|0|You lived a heretic, and you have died a heretic. How ironic.
