id|emoteid|event|type|text
797|471|3|1|emits a high pitched wail, ichor oozing from its battered carapace.
798|472|1|0|I have nothing left to lose.  Can you say the same?
799|472|3|1|falls, looking relieved.
800|473|3|1|roars in frustration.
801|474|1|0|Better to spill your blood here than in the halls of our city, knave!
802|474|3|0|Curse you!!  You shall have all the Haven Defenders on your head for this.
803|475|1|1|lunges at you in a fit of pained fury
804|475|3|0|Finally, the pain ends....
805|476|1|0|Since you refuse to accept the truth I'll open the gate to the otherworld for you myself!
806|477|1|0|Not my mushrooms!  I won't ever let you hurt my mushrooms!!
807|477|3|0|Nooo, who will take care of the mushrooooms?
808|478|1|0|I knew you'd come fer me!  I'll not go down witout a fight ye damned troglodyte!
809|478|3|0|Blast ye, 'tis the end of ol' Murph.
810|479|1|0|You dare show your face in here?  You shall not leave alive.
811|479|3|0|You will not escape us.  Behind every corner, In every shadow, your death awaits.
812|480|1|0|Grab yer pick lads, we got trouble!
813|481|1|0|If you thought a shovel was just for diggin, yer about to find out otherwise!
814|482|1|0|For the honor of King Gomklin, your treachery shall be punished!
815|483|1|0|For the honor of King Grery, your heresy shall be undone!
816|484|1|0|Prepare to meet your doom, enemy form below!
817|485|1|0|Prepare to die a traitor's death, enemy from above!
818|486|1|1|hisses threateningly as it slithers toward you!
819|486|3|1|slumps in defeat, its unholy lifeforce departing.
820|487|1|1|detaches from a rock and springs toward you.
821|487|3|1|falls dead at your feet.
822|488|1|0|Nac llits uoy elihw tuo teg!
823|488|3|0|Uoy ikil semong etah yllaer!
824|489|1|1|lunges at you with claws tearing at your bootlaces.
825|489|3|1|shell cracks as it falls lifelessly to the floor.
826|490|1|0|You'll find the Groveton guards to be worthy opponents!
827|490|3|1|shield clatters as it falls to the ground. 'uuunnh!'
828|491|1|0|That's the last mistake you'll make!
829|491|3|2|Guards! Guards!!
830|492|1|0|I'm gonna tie ya up and drown ya!
831|492|3|1|drops to his knees, mortally wounded.
834|493|4|0|What ya want?  You wouldn't be one of them Talikars come lookin for who robbed your gran daddys grave would ya?  Hahaha.  Get lost!
835|493|1|0|So you want a taste of my blades eh?  Lets dance!
836|493|3|0|You had best watch your backs fools!  My companions Rolktim and Missy shall avenge my death!!
837|494|1|1|smashes her giant fists together, and takes a step toward you.
838|494|3|1|sighs softly as she falls to the floor. 'Now I never see me love again.  Gor?'
839|495|1|0|Mooto na!  I show ya tha power of Tarmok!
840|495|3|1|curses you with his dying breath.
841|496|1|1|rushes toward you with unexpected speed!
842|496|3|1|thrashes a moment and then lies still.
843|497|1|1|hops toward you, leaving a cloud of spores in its wake.
844|497|3|1|slumps to the ground.
845|498|1|1|turns upon you, its leaves writhing angrily.
846|498|3|1|shrivels up, its life ebbing.
847|499|1|0|That's it, now you die!
848|499|3|0|Crossing the Shadel Bandits will be the ruin of you!
849|500|1|1|lurches toward you, its eyes wild from unbearable pain
850|500|3|1|explodes in splash of vile fluids, its body writhing briefly on the ground.
851|501|1|1|emits a small cloud of poison as it prepares to defend itself.
852|501|3|1|slumps over as it dies.
853|502|1|1|clacks menacingly, raising its claws to attack.
854|502|3|1|slashes at you one last time as its life ends.
855|503|1|1|hisses sharply and leaps for your throat!
856|503|3|1|falls to the ground, ichor flowing from its body.
857|504|1|0|Aaaieeee!  Beasties die, yub!
858|505|1|0|The Legion shall destroy you.
859|505|3|0|Ow....
860|506|1|0|For Seru!
861|506|3|0|I seem to have grasped a tiger by the tail
862|507|1|0|Time to earn my pay, I reckon.
863|507|3|0|This is not happening to me!
864|508|1|0|A little blood on the marble makes it shine nicely, don't you think?
865|508|3|1|looks down at her wounds, a look of disbelief on her face
866|509|1|0|Rhugol will be happy with your head, methinks.
867|509|3|0|You are dead as well, though you may not realize it yet........
868|510|1|0|I really hate..er, you have ruined your own..er, gah, I just plain want you dead!
869|510|3|0|I was supposed to be on caravan duty today....
870|511|1|0|Why can't we all just get along?  I will tell you why!  Killing each other is SO much fun.
871|511|3|0|Ooof!
872|512|1|0|It is going to be a pleasure watching you bleed out.
873|512|3|0|Too soon.
874|513|1|0|Guards! Guards!
875|513|3|0|This is not good.
876|514|1|0|There had best be a bonus in this for me.
877|514|3|1|slumps to the ground, eyes glazed over.
878|515|1|0|There is nothing I will enjoy more than gutting you.
879|515|3|0|50 platinum for a cleric!
880|516|1|0|You shall fall to the might of a Combine Warrior!
881|516|3|0|Arrrgh.
882|517|1|0|Your death shall be quick and clean.
883|517|3|0|Damn, that was fast!
884|518|1|0|You had best start praying Rhugol does not take offense to this!
885|518|3|0|Well blow me down!
886|519|1|0|I think I am going to enjoy putting you on my table.
887|519|3|0|This is not good.
888|520|1|0|I knew we should have watched you closer.
889|520|3|0|I spit on you!
890|521|1|0|Guards!  Guards!
891|521|2|0|You are banned from my shop forever!
892|522|1|0|Hahahahahahahaha. . . DIE!
893|522|3|0|Har..........
894|523|1|0|For Bikun!
895|523|3|0|My comrades will avenge my death.
896|524|1|2|Scared you, didn't I?
897|524|3|0|You have got to be kidding.
898|525|1|0|This ends now!
899|525|3|0|I wanted to see Kaladim again......
900|526|1|0|You should have stayed in bed this morning.
901|526|3|0|Arrrgh.
902|527|1|0|Ware, brothers and sisters of the Eye, one challenges our authority!
903|527|3|0|Who...?
904|528|1|0|Death or victory, it is all the same.  Either way, I get a rest.
905|528|3|0|I knew I should have joined the Legion instead.
906|529|1|0|Graaaaaaaaaaaaaaaaaaaaaaaaaaaaaaaaaaaaaaaaa!
907|529|3|0|Ahh....
908|530|1|0|Let me show you a trick I learned in Netherbian
909|530|3|0|Gah. I'd rather be drunk than dead, ya know?  Have ye any spirits?
910|531|1|0|Damn!  I just had this uniform cleaned.
911|531|3|1|locks eye with you.  You see the life flowing out.
912|532|1|0|Why the nerve!
913|532|3|0|Zavi, I loved you.....
914|533|1|0|What dimwitted Legionnaire passed you through the gates?
915|533|3|0|Am I wearing a red shirt or something?
916|534|1|0|I have spent my life waiting for this moment!
917|534|3|0|Comrades avenge my death my rump!  I will come back for you myself!
918|535|1|0|Aiiiiiieeeeee!
919|535|3|0|Mother!
920|536|1|0|Ha!  This should be fun.
921|536|3|0|Frazzlewrack!
922|537|1|0|Seru Victa!
923|537|3|0|Well, I'll be a.....
924|538|1|0|Let me show you a trick I learned in Netherbian
925|538|3|0|For S...sss...Seru!
926|539|1|0|Cripes!
927|539|3|0|What are you staring at?  Let a body die in peace.
928|540|1|0|Pain. Lots of pain!
929|540|3|0|No......
930|541|1|0|Fools should not be allowed to breed.
931|541|3|0|My comrades will avenge my death.
932|542|1|0|I so enjoy a spot of exercise!
933|542|3|0|And I took a promotion for this?
934|543|1|0|You fool!
935|543|3|0|I knew this was a bad day to get out of bed.
936|544|1|0|That was not very smart.
937|544|3|0|I knew I should have worn clean undergarmets today.
938|545|1|0|Messing with Nuno is a no no.
939|545|3|1|rages futilely against death
940|546|3|0|I guess you won't be buying me that drink after all?
941|547|1|0|I knew this was going to happen!
942|547|3|0|Why do I always allow myself to get into trouble.
943|548|1|0|Guards!  Guards!
944|548|3|0|My comrades will avenge my death.
945|549|1|0|I expected as much from the likes of you.
946|549|3|0|Who watches the Watchers?  Hahahaha...urk!
947|550|1|0|You have a lot of nerve, I will give you that.
948|550|3|0|Who watches the Watchers?  Hahahaha...urk!
949|551|1|0|For Vantorus!
950|551|3|0|No easy thing, defeating an Optio.
951|552|1|0|Killing outlanders, and getting paid for it!  I love my job!
952|552|3|0|There has to be a better way to make a living.
953|553|1|0|Brothers of the Hand let us show this imbecile who has the greater skill!
954|553|3|0|My comrades will avenge my death.
955|554|1|0|You should not have done that.  Before I retired, I was a meanest mother lover in the Legion.  Now I am just the meanest mother lover in this bar.
956|554|2|0|You had to get your friends to help.  Wimp.
957|555|1|0|Man oh man, I HATE when people start trouble in here.
958|555|2|0|Damn it James, I am a bartender, not a moon ferry conductor!
959|556|1|0|Take it outside!
960|556|2|0|I hope you do not think this means I am going to forget your bar tab...
961|557|1|0|The Eye shall hear of this!
962|557|3|0|Who watches the Watchers?  Hahahaha...urk!
963|558|1|0|Toes, fingers, skulls, it is all the same to me.
964|558|3|0|Wuhhh......
965|559|1|0|My brothers would die if they could see me now.  Ha!
966|559|3|0|Why me?
967|560|3|0|Seru preserve us!
968|561|1|0|Who shall sing at your funeral?
969|561|3|0|So much I wanted to do before........
970|562|1|0|I have better things to do with my time.
971|562|3|0|Damn....
972|563|1|0|I will hear you scream.
973|563|3|0|Wuhhh......
974|564|1|0|You are in for a rude awakening!
975|564|3|0|I wish...
976|565|1|0|None shall enter the Arx!
977|565|3|2|Guardians of the Arx, one has fallen!
978|560|1|0|You have no idea the depth of trouble you are now in.
979|566|1|0|Ah, welcome to my nightmare.
980|566|3|0|Why me?
981|567|1|0|I hate days like this.
982|567|3|1|looks very surprised.
983|568|1|0|Oh, so that is how it is going to be then?  Fine.
984|568|3|0|Arrrgh.
985|569|1|0|Redhands is not my name, you know.  It is merely an occupational description.
986|569|3|0|Wuhhh.......
987|570|1|0|I WILL have answers from you.
988|570|3|1|coughs blood.
989|571|1|0|You are about to feel the pointy end of my boot where your stop exits!
990|571|3|1|falls at your feet, dead.
991|572|1|0|Yeehaw, a fight!
992|572|3|1|coughs and whispers 'Praise to Seru my a.............'
993|573|1|0|The Eye will repay this a thousandfold.
994|573|3|0|Poop!
995|574|1|0|Raaaaaaaar!
996|574|3|0|Who watches the Watchers?  Hahahaha...urk!
997|575|1|0|A long night it shall be for you, indeed.
998|575|3|0|This is not good.
999|576|1|0|To arms!  To arms!
1000|576|3|0|If all outlanders fight this good, we are in trouble.
1001|577|1|0|For the honor of Seru!
1002|577|3|0|A short life for a short man, eh?
1003|578|1|0|Have at ye!
1004|578|3|0|Death claims us all in the end.  I will be waiting for you.
1005|579|1|0|Legionnaires, to arms!
1006|579|3|0|Death is but the beginning...
1007|580|1|0|I do not get paid enough for this..
1008|580|3|0|Who watches the Watchers?  Hahahaha...urk!
1009|581|1|0|I do not get paid enough for this..
1010|581|3|0|My comrades will avenge my death.
1011|582|1|0|Did you know there are over ten thousand ways to inflict pain without killing?
1012|582|3|0|Why me?
1013|583|1|0|Oho, it is on!
1014|583|3|0|You hit like a girl!  Is that the best you can do!  Ha, sissy..you...you...noodle armed...armed...gah.
1015|584|1|1|draws steel and advances.
1016|584|3|0|Damn...
1017|585|1|0|I am a busy person, you will pay for taking my time.
1018|585|3|0|This is not good.
1019|586|1|0|My true foot up your true behind..how does that sound?
1020|586|3|0|This is no fitting place for a dwarf to die.
1021|587|1|0|For Bikun!
1022|587|3|0|Horse dung!
1023|588|1|0|Lets see them call me Butthead after this!
1024|588|3|0|I wish...
1025|589|1|1|charges to make an attack.
1026|589|3|1|lets loose one last odd chittering noise before falling to the ground.
1027|590|1|0|Bent arms, broken backs, all tools of the trade.
1028|590|3|1|coughs blood.
1029|591|3|0|if all outlanders fight this good, we are in trouble.
1030|592|1|0|You are not going to enjoy this, I assure you!
1031|592|3|0|Am I....?
1032|593|1|0|There is no escape
1033|593|3|0|Basta......
1034|594|1|0|Watch this!
1035|594|3|0|Who watches the Watchers?  Hahahaha...urk!
1036|595|1|0|There are easier ways to commit suicide.
1037|595|3|1|looks very surprised.
1038|596|1|0|I hope your bags are packed.
1039|596|3|1|flops about for a moment, then is still.
1040|597|1|0|Give it a break, you have no chance.
1041|597|3|0|my comrades will avenge my death.
1042|598|1|0|No mercy!
1043|598|3|0|Well done, you sheep kissing, diseased son of a goblin loving mother.  Well done indeed.
1044|599|1|0|Good grief!
1045|599|3|0|Frick!
1046|600|1|0|I didn't think it would happen like this.
1047|600|3|0|I didn't think it would happen like this.
1048|601|1|0|I hope you have no children, for they are soon to be orphans.
1049|601|3|1|scowls.
1050|602|1|0|Damn Outlanders!
1051|602|3|0|Palti!
1052|603|1|0|Ho ha!  You wish to dance with the fat man, eh?  Come then, let me show you a few steps.
1053|604|1|0|DIE DIE DIE!
1054|604|3|0|Death claims us all in the end.  I will be waiting for you.
1055|605|3|0|I didn't think it would happen like this.
1056|606|1|0|Bad decision, $name.
1057|606|3|0|I see clearly now.
1058|607|1|0|Cross us at your own risk.
1059|607|3|0|This is no victory for you.
1060|608|1|0|You dare challenge the Eye?
1061|608|3|0|Rhugol, they come!
1062|609|1|0|I knew you were going to do that!
1063|609|3|0|Now this, this comes as a surprise!
1064|610|1|0|You must be as stupid as you look.
1065|610|3|0|Maybe I was the stupid one, eh?
1066|611|1|0|I am going to slap the dumb right out of you.
1067|611|3|0|The Combine shall..........
1068|612|1|0|Unclean, untrue, and unworthy!  Undone I shall make you!
1069|612|3|0|It is I that is undone.  Oh, a tragedy indeed!
1070|613|1|0|And to think I worried about missing combat when I was promoted.
1071|613|3|0|Did you hear that?
1072|614|3|0|Well fought, well fought indeed!
1073|615|1|0|Rasha will see you buried.  Parts of you, anyway.
1074|615|3|0|My comrades will avenge my death.
1075|616|1|0|Freeze!
1076|616|3|0|Dead!
1077|617|1|0|It is going to be one of those days.  *SIGH*
1078|617|3|1|lies staring at you, eyes open in death.
1079|618|1|0|Your death shall be long and messy.
1080|618|3|0|Who would believe it?
1081|619|1|0|Legionnaries!  We have an enemy in our midst!
1082|619|3|0|I didn't think it would happen like this.
1083|620|1|0|Hssss!
1084|620|3|0|Well if this isn't a big pile of steaming dung!
1085|621|1|0|I am one of the chosen of Seru!
1086|621|3|1|falls at your feet, dead.
1087|622|1|0|Odd.  You look far less foolish than you actually are.  No matter.  Legionnaires, to me!
1088|623|1|0|If you only knew how much this pains me.....
1089|623|3|0|Death claims us all in the end.  I will be waiting for you.
1090|624|1|0|$name! Prepare your mind for eternity.
1091|624|3|0|Foolishness.
1092|625|1|0|I do believe we have a winner here folks!  Step right up and take a look at the newest dead man in Sanctus Seru!
1093|625|3|0|It is so cold........
1094|626|1|0|Matpa will have your head for this!
1095|626|3|0|The pain......
1096|627|1|0|Defend the Heart!
1097|627|3|0|What the ...look at that hole!
1098|628|1|0|Do not underestimate the Heart!
1099|628|3|0|I hope those bloodstains never come out!
1100|629|1|0|You are a sick little piggy.
1101|629|3|0|Oh. So THAT is what it looks like. Interesting.
1102|630|1|0|It must be pretty embarrasin' to be killed by a glorified clerk, eh?
1103|630|3|0|Four days from retirement......
1104|631|1|0|They say that we are only parchment pushers.  Watch me push a blade into your innards.
1105|631|3|0|Shi........
1106|632|1|0|Woe unto you.
1107|632|3|0|I can't froaking believe you froaking defeated me, you froaking scum, Froaaak!
1108|633|1|0|I think I will take your ears as a trophy.
1109|633|3|0|Farg!
1110|634|1|0|Let me school you in the errors of your ways!
1111|634|3|0|Perhaps I should call you the teacher.
1112|635|1|0|Like hot butter through a knife.  Um, like a, well, you know what I mean. I am going to cut you!
1113|635|3|1|reaches for you, desperation distorting his features
1114|636|1|0|Ho ho!  These old arms still have a fight or two left in them!
1115|636|3|0|Woof!
1116|637|1|0|Ligma will demonstrate the error of your ways.
1117|637|3|1|seems to be trying to say something.....
1118|638|1|0|DESTROY!
1119|638|3|0|SLAIN!
1120|639|1|0|You dare much, but it will profit you little.
1121|639|3|0|I don?t believe you defeated me.
1122|640|1|0|I swear, if you make my cake drop......!
1123|640|2|0|I play to bake bread, not crush!
1124|641|1|1|hisses at you.
1125|641|3|1|falls to its side, no longer breathing.
1126|642|1|1|raises its claws in fury!
1127|642|3|1|attempts to strike one last time...
1128|643|1|1|growls...
1129|643|3|1|falls lifelessly to the ground.
1130|644|1|0|The master is always in need of new sacrifices.  I hope he'll find you worthy!
1131|644|3|0|For every one that falls, two shall rise!  So says the master!
1132|645|1|0|These mines are property of the grimling empire!  You have trespassed and now you die!
1133|645|3|1|slumps to the ground in a puddle of dark blood
1134|646|1|1|emits an eerie screech and charges ferociously!
1135|646|3|1|squeals in pain and falls to its side as the life fades from its eyes
1136|647|1|0|Glortuk goomash clobtoga!
1137|647|3|0|Uuuuhhh...arg!
1138|648|1|1|beats its wings furiously and screeches dripping saliva and showing its sharp fangs.
1139|648|3|1|falls lifelessly to the ground.
1140|649|1|1|speaks in a voice like grinding stones, 'Mountain Tegi made of stone will crush this being of flesh and bone!'
1141|649|3|0|Uuuuhhh...arg!
1142|650|1|1|hisses revealing menacing fangs and lunges ferociously at its prey!
1143|650|3|1|collapses to the ground and begins to decompose at an alarming rate
1144|651|1|0|The winds will aid in your defeat.
1145|651|3|0|Let my spirit soar on the winds.
1146|652|1|1|prepares to crush you
1147|652|3|0|The rocks shall shake as the earth itself avenges me.
1148|653|1|1|roars a bestial war cry spraying red spittle as flames of rage fill his eyes!
1149|653|3|1|goes limp and falls from the air bursting into a cloud of dust upon impact with the ground
1150|654|4|1|coughs a few times and reaches out to you, 'Please help me.'
1151|655|1|0|You will pay for your mistake by dying!
1152|655|3|0|I shall have my revenge one day.
1153|656|1|0|Oh look, a talking lump of refuse. How novel!
1154|657|1|1|emanates darkness as it approaches.
1155|657|3|1|slowly fades away.
1156|658|1|1|is coming right at you.
1157|658|3|1|dissipates into the air.
1158|659|1|1|plods angrily towards you.
1159|659|3|1|shudders and falls back to the earth.
1160|660|1|1|burns brighter, it's coming for you.
1161|660|3|1|flames slowly burn out.
1162|661|1|1|bubbles and starts attacking you.
1163|661|3|1|collapses to the ground as its watery body loses form.
1164|662|1|1|opens its mouth to take a nibble.
1165|662|3|1|floats toward the surface of the sea.
1166|663|1|1|moves toward you in anger.
1167|663|3|1|pauses for a second shocked and then dies.
1168|664|1|0|You will burn for your transgressions against the Tro Jeg Clan.
1169|664|3|0|My spirit goes to join the everburning fire of death.
1170|665|1|1|lunges angrily towards you.
1171|665|3|1|shudders and then lies still on the ground.
1172|666|1|1|clicks as it prepares to attack.
1173|666|3|1|makes one last click and then collapses to the ground.
1174|667|1|0|I will flow as the water and emerge victorious.
1175|667|3|0|May my spirit find peace in the waters.
1176|668|1|1|fixes its fiery gaze upon you as it moves to attack.
1177|668|3|1|eyes slowly fade away as it dies.
1178|669|1|1|skitters towards you.
1179|669|3|1|stops moving and falls down as the rest of its life ebbs away.
1180|670|1|1|is coming at you.
1181|670|3|1|shrivels up and falls to the ground dead.
1182|671|1|1|growls and leaps to attack.
1183|671|3|1|lets out one last almost inaudible growl and then falls to the ground dead.
1184|672|1|1|shows its fangs as it prepares to make a meal of you.
1185|672|3|1|falls to the ground in a lifeless heap.
1186|673|1|0|I am of the Blood Tribe.  You will now die!
1187|673|3|0|The Blood Tribe shall avenge my death.
1188|674|1|1|Snarls and leaps!
1189|674|3|1|ceases to move.
1190|675|1|0|Submit!
1191|676|1|0|Foolish small-mind!  You will long rue the day you met our kind.
1192|676|3|0|Dead or a slave, it matters not to me.
1193|677|1|0|One portion, one portion in four!  I shall drink your soul, and wish for more!
1194|677|3|0|I, ah, I see the path I should follow, but something blocks it!  You have done me no favors mortal, I will be reformed by my master's will.
1195|678|1|0|Two portions, two portions of three!  The third to you, our master, we give to thee!
1196|678|3|0|Released!  I see the way now, I shall be free.  No!  No master, please!  I am so close, I beg thee, let me rest!  Aiiiyeee!
1197|679|1|0|I sense this will be a poor feeding, since only a fool would venture here to our lair, and the soul of a fool is meager sustenance.
1198|679|3|0|I have tasted your souls, and I WILL feed on them soon.
1199|680|1|1|ponderously swings at you with massive fists!
1200|680|3|1|falls to the ground with a thunderous crash!
1201|681|1|0|Death shall enslave you, as it has me!
1202|681|3|1|crumples to the ground, stirring up a cloud of dust.
1203|682|1|1|turns upon you with death in its eyes.
1204|682|3|1|falls to the ground with a thunderous crash.
1205|683|1|1|grates ominously, stone rubbing against stone as it attacks!
1206|683|3|1|becomes still, then drops to the ground abruptly leaving a lifeless pile of stones.
1207|684|1|1|rumbles menacingly as it strikes!
1208|684|3|1|shudders briefly, and becomes still.
1209|685|1|1|thrashes about, preparing its attack!
1210|685|3|1|spews blood from its jaws, crumpling as the life fades out of its body.
1211|686|1|0|Your soul shall be mine, air breather!
1212|686|3|1|burns brightly a moment, before sinking to the ground.
1213|687|1|1|tastes the air, it seems to sense an intruder.
1214|687|3|1|falls dead to the floor, its eyes filled with disbelief.
1215|688|1|1|drips black blood as it slides across the floor at you.
1216|688|3|1|falls to the floor.  You are uncertain if it is truly dead this time.
1217|689|1|1|spits black blood on your armor and slithers toward you.
1218|689|3|0|Death is but a doorway, for a god!
1219|690|1|1|strikes at you in a flurry of blackened blood and bile.
1220|690|3|1|falls to the floor.  You are uncertain if it is truly dead this time.
1221|691|1|1|spits black blood on your armor and slithers toward you.
1222|691|3|1|falls in a pool of black blood.
1223|692|1|1|spits black blood on your armor and slithers toward you.
1224|692|3|0|Excellent, a soul to consume.
1225|693|1|0|I can smell the weakness in you, wretch.
1226|694|1|1|swings at you with amazing speed!
1227|695|1|1|drips black blood as it slides across the floor at you.
1228|695|3|1|falls in a pool of black blood.
1229|696|1|0|Welcome to your new home, slave!
1230|697|1|1|laughs and attacks you!
1231|698|1|0|Take one last look at the face of your god!
1232|699|1|1|releases a roaring hiss and attacks!
1233|700|1|1|slithers across the floor, fangs gleaming with poison.
1234|700|3|1|falls dead to the floor, its eyes filled with disbelief.
1235|701|1|1|spreads its hood and strikes at you.
1236|701|3|0|How...did...ugh...
1237|702|1|1|slithers at you with amazing speed!
1238|703|1|1|glows with power as it prepares its attack!
1239|704|1|0|How does it feel to meet your god face to face?
1240|704|3|0|How...did...ugh...
1241|705|1|1|spits black blood on your armor and slithers toward you.
1242|705|3|1|falls to the floor.  You are uncertain if it is truly dead this time.
1243|706|1|0|Excellent, a soul to consume.
1244|706|3|1|falls in a pool of black blood.
1245|707|1|1|tastes the air, it seems to sense an intruder.
1246|707|3|0|How...did...ugh...
1247|708|1|1|drips black blood as it slides across the floor at you.
1248|708|3|0|Excellent, a soul to consume.
1249|709|1|1|strikes at you in a flurry of blackened blood and bile.
1250|709|3|1|falls in a pool of black blood.
1251|710|1|1|tears away from the wall and tries to pummel you.
1252|710|3|1|crumbles to the ground, devoid of all life.
1253|711|1|0|What kind of fool enters this place uninvited?
1254|711|3|1|falls to the floor, its eyes filled with disbelief.
1255|712|1|1|glares at you with unblinking eyes.
1256|712|3|1|falls to the ground dripping green blood on the stone floor.
1257|713|1|1|drips black blood as it slides across the floor at you.
1258|713|3|0|Death is but a doorway, for a god!
1259|714|1|0|Excellent, a soul to consume.
1260|714|3|1|falls to the floor.  You are uncertain if it is truly dead this time.
1261|715|1|0|Ah good, more blood to experiment with.
1262|715|3|0|Death...cannot...have...me...
1263|716|1|1|spreads its hood and strikes at you.
1264|716|3|0|Death...cannot...have...me...
1265|717|1|0|Excellent, a soul to consume.
1266|717|3|0|Death is but a doorway, for a god!
1267|718|1|1|raises his arms in anger.
1268|718|3|1|falls lifelessly to the ground.
1269|719|1|0|Tavuel tekar!
1270|719|3|0|Xua ane matarun!
1271|720|1|1|growls angrily.
1272|720|3|1|falls lifelessly.
1273|721|1|1|reveals its fangs.
1274|721|3|1|descends from the sky, crashing to its death.
1275|722|1|1|beneath you begins to open up.
1276|723|1|1|rampages toward you.
1277|723|3|1|falls forward, unleashing a hollow roar.
1278|724|1|1|brandishes razor sharp claws and circles inward.
1279|724|3|1|unleashes a lupine yelp as it collapses on the floor.
1280|725|3|1|collapses forward.
1281|726|1|1|races toward to attack.
1282|726|3|1|stops moving.
1283|727|1|1|flies forward, gnashing its teeth.
1284|727|3|1|flutters to the ground.
1285|728|1|1|scuttles forward to attack.
1286|728|3|1|collapses in a heap of broken legs.
1287|729|1|1|drips venom from its fangs and advances.
1288|729|3|1|rolls over, curling its legs over its body.
1289|730|1|1|charges forward.
1290|730|3|1|curls away from its attacker and dies.
